,title,description,title_label,description_label
285, 비정규직 고용불안 해결해야 대선 후보 향한 노동자들의 요구,시민들은 새 정부에  만  세  정년 연장   인 미만 사업장 근로기준법 적용   상병수당 및 유급병가 도입  등을 우선 추진해야 할 과제로 꼽았다   주  일 또는  일제 도입  역시  의  ,1,0
286, 가장 우려하는 대선 공약은 주  일제 , 세 이상 계속 고용 또는  정년 연장  법제화 를 꼽은 전문가도  명 이었다  한국 경제가 다시 성장하기 위해 필요한 대선 공약을 묻는 질문엔   등 신산업 집중 육성 이라고 답변한 전문가가  명 으로 가장  ,0,1
287, 리포트   년 강원 평균 나이  살 정년 연장 이 해법 될까, 뉴스 김도균입니다 영상취재 최정현  강원도청년  정년연장   청년유출  초고령사회  평균연령 세 춘천  뉴스는  시간 여러분의 제보를 기다립니다    전화  ,1,0
288,김용호의 전통문화 반딧불이  정년 연장  전통문화의 거울에 비추어 ,최근 국내외 정치권에서 다시금  정년 연장  문제가 공론화되고 있다  고령화 사회 진입과 노동 인구 감소 문제를 고려하면 불가피한 흐름이라는 시각도 있지만  청년 일자리 문제  기업 부담 증가 등 우려도 적지 않다  ,1,1
289, 부산 버스 파업 협상 중  부울경  만 대 멈춰서나 요구사항은 ,노조는 기본급   인상과 현행  세인  정년 을  세로  연장 하는 것을 요구하고 있다  협상이 결렬될 경우  일 첫 차부터 총파업에 돌입하겠다고 예고했다   일 실시한 파업 찬반 투표에서는 전체 조합원  명 중  ,0,0
290,광주시  시내버스 파업 대비  비상수송대책  총력 시민 불편 우려 커져,이번 파업은 임금   인상 및  정년 연장 세 세 을 요구하는 노조 측과 임금 동결을 주장하는 사측의 입장차가 주요 쟁점이다  광주지역 운전원 연평균 급여는 대전 대구와 비슷한 수준이며  파업 기간 운전원  ,0,0
291, 이진우칼럼  피크코리아 대선  새로운  커브를 향해,구조개혁 없이 재정 확대에만 의존하는 단기 부양책  생산성은 쏙 빠진 노동시간 단축과  정년 연장  구체성이 결여된 규제 완화  재원 대책 없는 복지 확대 등은 한국 경제의 성장 잠재력을 더욱 약화시킬 뿐이다  국가  ,1,0
292,대구 경북 시내버스 정상 운행,시내버스 업계는 임금인상과  정년연장  문제를 두고 극명한 입장차를 보였다  노조는 평균 시급 만 원    인상   정년 연장 을 요구하고 있는 반면  사측은 임금동결   정년연장  불가 방침을 고수 중이어서다  또  ,0,0
293, 이로운체크 버스 총파업 전국 확산 초읽기 울산 부산 광주 강경  대 ,투입  지하철 증편  유연근무제 도입  자가용 이용 장려 등 총력 대응에 나서고 있다  그러나 통상임금과 임금체계 개편   정년 연장  등 복잡한 구조적 문제들이 얽혀 있어 노사 간 합의는 쉽지 않다는 관측이 우세하다 ,0,0
294,서울 버스 노조  내일부터 파업 돌입  오늘 막판 교섭,이와 함께 기본급   인상  운전직 호봉 상한 상향   정년 연장  하계 유급휴가 신설 등도 요구합니다  반면  사측은 대법원 판결에 따라 정기상여금을 통상임금에 반영하고 노조의 인상 요구를 모두 수용할 경우  의  ,0,1
295,부산 시내버스 최종협상 시작 결렬 시 내일 총파업,노조는 임금   인상과  정년 연장  등을 요구하지만  사측은 경영상 이유로 받아들이지 않은 거로 알려졌습니다  부산시는 협상이 결렬돼 시내버스가 파업에 들어가면 전세버스  백 대를  개 임시 노선에 투입하고  ,1,0
296,전국 시내버스노조 총파업에 대구는 불참 추가 교섭 진행,이에 사측은 임금 동결과  정년 연장  불가 입장을 내며 맞섰다  교섭에는 대구 시내버스 업체  곳 중  곳이 참여하고 있다  만약  노조가 파업에 들어가면 교통대란이 현실화 할 수도 있다는 전망이 나온다  노조 관계자는  ,0,1
297,부산 시내버스 파업  노사  벼랑 끝 협상  돌입,노조는 지난해  월 대법원 판결에 따라 정기상여금의 통상임금 포함을 비롯해 기본급   인상과  정년 연장  등을 요구하고 있다  반면 사측은 통상임금이 늘어나면 각종 수당도 늘어나는 만큼 기본급 인상까지 할 경우  ,0,1
298,제주 버스노조  파업 참여않고 정상운행 월 초  차 조정회의 ,이날 회의에서 노조는  정년 을  세로  연장 하고 격일제 근무를  일  교대로 전환해줄 것을 사측에 요구했다  제주도 버스준공영제 노동자들은 오전  시에 출근해 오후  시 퇴근한 뒤 다음 날 쉬는 격일제 근무  ,0,1
299,부산 울산 창원도 버스 파업 초비상 비상 수송대책 마련,임금 인상과  정년연장  통상임금 적용 범위 등을 둘러싼 이견이 좁혀지지 않을 경우  버스는  일 첫차부터 운행을 멈춘다  특히 울산은 지하철이 없는 데다 대체 수단인 전세버스조차 확보하지 못한 상황이어서 파업이  ,0,0
300, 일 시내버스 파업 예고에 광주광역시  초긴장 대책회의 개최,노조는 임금   인상   정년   세에서  세로  연장  등을 요구하고 있는 반면 사측은 지난해 수준 동결 입장이다  서울  인천  부산 등 타 시도의 쟁점인 통상임금 관련해서는 광주의 경우  년 상여금 등이 통상임금에  ,0,0
301, 이로운체크 서울 버스  일 전면 파업 예고 시민  출퇴근 혼란  현실 ,노사 갈등 격화 사측  파업 불참자 복지 중단은 부당한 차별 쟁점은  통상임금 반영 과  정년 연장 노사 협상 평행선서울시  시민 불편 최소화 총력 지하철 셔틀버스 등 총동원 이로운넷   이수진 에디터 서울 시내버스  ,0,0
302, 대선공약 비교   국가 책임 기본사회     맞춤 지원  이재명 김문수 ,교육은 공교육 국가책임 강화  돌봄 학습 통합지원  평생학습 체계 고도화를 포함하며  노동정책에서는 주  일제 도입   정년 연장  상병수당 확대를 통해 일과 삶의 균형을 지향한다  교통 통신 영역도 포함돼 있으며  ,0,1
303,대구 시내버스 노조  일 파업 참여 보류  정상 운행될 듯,사측 관계자는  지난해 대법원의 전원합의체 판결로 인해 상여금이 통상임금으로 포함돼 먼저 임금체계 개편이 돼야 협상이 가능하다 며  정년 연장 은 검토 중 이라고 전했다  앞서 노사는 지난  일  차 임금  ,0,0
304,서울 시내버스 또 멈추나 오늘 막판 비공개 교섭,이와 함께 기본급   인상  만  세인  정년 의  세  연장  하계 유급휴가 신설  운전직 호봉 상한 상향 등을 요구하고 있다  반면 사측인 서울시버스운송사업조합은 정기 상여금을 기본급에 포함하는 등 임금체계 개편이  ,1,0
305,소득 불안정한 충청 고령화  시니어 고용 여건 개선해야,특히  세의 하락 폭이  로 두드러져  정년 연장 의 필요성이 강조된다  심각한 건 장년층에서 계속 근로하기를 희망하고 있음에도 생애 주된 일자리와 관련 없는 비정규직 비중이 늘고 있다는 데 있다  ,0,0
306,광주 시내버스   운행 보장   일 파업 대비  비상수송 대책  가동,한편  광주 시내버스 노조는 임금   인상과  정년 연장 세에서  세 을 요구 중이다  사측은 지난해 수준 동결을 고수하고 있다  파업 여부는 조합원 찬반투표와 지방노동위원회 조정 결과에 따라 최종 결정될 예정이다  ,0,0
307,광주광역시  시내버스 파업대비 비상수송대책 마련,노조는 임금   인상   정년   세에서  세로  연장  등을 요구하고 있는 반면 사측은 지난해 수준 동결 입장이다  서울  인천  부산 등 타 시도의 쟁점인 통상임금 관련해서는 광주의 경우  년 상여금 등이 통상임금에  ,0,0
308,고려대 동탄병원  진료부터 케어까지 망라 ,또한 고대안암과 구로  안산병원의 인력을 할당하고  정년 교수 영입과  정년 연장  제도를 활용할 계획도 시사했다  한편 고려대의료원은 고대안암  구로  안산병원을 비롯해 정릉과 청담에 연구갬퍼스를 보유하고  ,0,0
309,대구 시내버스  전국 총파업 속  정상 운행 노사 협상은 평행선,파업이 현실화되면 지역 교통상황에 미치는 영향이 적지 않을 전망이다 현재 시내버스 업계는 임금인상과  정년연장  문제를 두고 극명한 입장차를 보인다  노조는 평균 시급 만 천 원    인상   정년 연장 세 세  ,0,1
310,광주시  시내버스 파업대비  비상수송대책  마련,노조는 임금   인상   정년   세에서  세로  연장  등을 요구하고 있는 반면 사측은 지난해 수준 동결 입장이다  서울  인천  부산 등 타 시도의 쟁점인 통상임금 관련해서는 광주의 경우  년 상여금 등이 통상임금에  ,0,0
311,광주시  시내버스 파업 대비 비상수송 대책 마련 시민 불편 최소화 총 ,노조는 임금   인상   정년   세에서  세로  연장  등을 요구하고 있는 반면 사측은 지난해 수준 동결 입장이다  서울  인천  부산 등 타 시도의 쟁점인 통상임금 관련해서는 광주의 경우  년 상여금 등이 통상임금에  ,0,0
312,본교섭 들어간 포스코 임단협 올해 초점도  기본급 인상 ,이 자리서 노조는  임금 베이스업   인상  철강 경쟁력 강화 공헌금    자사주  주 지급  정년 연장   의료비 지원 제도 신설과 임금성 항목  가지  단체협약 갱신 항목  가지  단순 문구 변경  가지를 요구  ,1,0
313, 숏폼 민심은 좀 다르던데 사흘만에  만 기록한 이준석,그는  이재명의 대책없는  정년 연장   토론 두 번에 드러난 이재명의 깡통 경제관  등의 영상을 업로드해 지지율 선두를 달리는 이재명 후보를 꾸준히 견제하고 있다 ,0,1
314,광주 시내버스 멈추나 임차버스 투입  출 퇴근 유연근무, 일 조합원 찬반투표 결과와  일 노동쟁의  차 광주지방노동위원회 조정 결과에 따라 결정될 예정이다  노조는 임금   인상   정년   세에서  세로  연장  등을 요구하고 있는 반면 사측은 지난해 수준 동결 입장이다 ,0,0
315,대구시내버스 노조  파업 당분간 미참여 교섭 계속,노조 요구사항은  시급 평균  만 천 원 호봉 기준    인상  정년  만  세에서  세로  연장  등이다  노조 관계자는  남은 교섭을 거치고도 협상이 결렬될 경우 조정 신청과 파업도 검토할 예정 이라고 말했다  ,1,0
316,대구 시내버스 노조  전국 총파업 불참 임단협 교섭은 지속 진행,노조는 임금 평균  만 원    인상과 정년을 만  세에서  세로 연장하는 안을 요구하고 있고  사측은 임금 동결과  정년 연장 이 불가하다는 입장을 유지하고 있다  노조는 추가 교섭 진행 후 결렬 시 파업을 검토할  ,0,0
317,부울경 시내버스 노사 임단협 최종 협상  교섭 결렬 땐 총파업 현실화,울산과 경남을 포함한 전국 버스노조들도 임금인상과  정년연장  등 같은 요구를 내걸고 있어 파업이 현실화할 경우 전국적인 교통 혼란이 예상된다  총파업이 실제로 이뤄지면  년 이후  년 만으로  부산 시내버스  ,1,1
318, 데스크칼럼   어떻게 가 없는 이재명의 언어,이 후보는 사회 쟁점으로 분류되는 의대 정원 확대  차별금지법 도입  주  일제 및  정년연장  도입 등의 사안에 대해서도 명확한 방향성이나 구체적 실행 매뉴얼을 제시하지 않은 채  사회적 합의가 필요하다 는 중의적  ,0,1
319,광주시  시내버스 파업대비 비상수송대책 마련,   일 조합원 찬반투표 결과와  일 노동쟁의  차 광주지방노동위원회 조정 결과에 따라 결정될 예정이다  노조는 임금   인상   정년   세에서  세로  연장  등을 요구하고 있는 반면 사측은 지난해 수준 동결 입장이다 ,0,0
320,서울 시내버스 노사 협상 막판 시동 결렬되면  일부터 파업,여기에 노조는 기본급   인상  그리고 현행 만  세인  정년 의  세  연장  하계 유급휴가 신설  운전직 호봉 상한 상향 등을 요구하고 있다  반면 사측인 서울시버스운송사업조합은 정기 상여금을 기본급에 포함하는 등  ,0,0
321,광주 시내버스 노조   일 파업 예고 시  대책회의,노조는 임금   인상   정년   세에서  세로  연장  등을 요구하고 있는 반면  사측은 지난해 수준 동결 입장이다  서울 인천 부산 등 타 시 도의 쟁점인 통상임금 관련해서는 광주의 경우  년 상여금 등이 통상임금에  ,0,0
322,대구시 공무직  정년 연장   임금 피크  논란 전국 첫 시도에 노사 갈등,전국 최초로 공무직 근로자  정년 연장 에 나선 대구시가 임금피크제 도입을 제안하면서 노조가 강하게 반발하고 있다   일 대구시 등에 따르면 시는 민주노총 공공연대노동조합 대구시공무직지부와 지난달  일과 지난  ,0,0
323,정경자 경기도의원 국회의원 사회복지사 처우개선 간담회서  대선후 남 ,이날 간담회에서는  사회복지사 경력   인정  인건비 가이드라인 준수  정년 연장   경력관리시스템 도입  처우개선비 인상 및 지급대상 확대 등 복지 현장의 목소리를 반영한 다양한 정책 과제가 제안되었다  이는  ,1,0
324, 사흘만  만 조회수 대선 후보들  쇼츠 전쟁 ,그는  이재명의 대책없는  정년 연장   토론 두 번에 드러난 이재명의 깡통 경제관  등의 영상을 업로드해 지지율 선두를 달리는 이재명 후보를 적극 견제하고 있다  또 타 유튜버와의 협업을 통해 상대 후보들과 차별화를  ,0,1
325,시내버스 노조 파업 예고 광주시  비상수송대책 마련,노조는 임금   인상   정년   세  연장  등을 요구하고 있는 반면 사측은 지난해 수준 동결 입장이다  광주 시내버스의 경우 통상임금이 쟁점인 타 시도와 다르게 상여금 등이 이미 통상임금에 반영돼 있어 노사 협상이  ,0,0
326,광주광역시  시내버스 파업대비 비상수송대책 마련,노조는 임금   인상   정년   세에서  세로  연장  등을 요구하고 있는 반면 사측은 지난해 수준 동결 입장이다  서울  인천  부산 등 타 시도의 쟁점인 통상임금 관련해서는 광주의 경우  년 상여금 등이 통상임금에  ,0,0
327,대구 공무직노조   정년 연장  빌미로 임금 삭감 강요 대구시청 규탄,노동자의  정년 연장 을 조건으로 임금 삭감을 강요하고 있다며 강력히 규탄했다  노조는 기자회견에서  대구시는 지난해  월 정년을  세에서  세까지 단계적으로  ,0,0
328,광주시  시내버스 파업대비 비상수송대책 마련,노조는 임금   인상   정년   세에서  세로  연장  등을 요구하고 있는 반면 사측은 지난해 수준 동결 입장이다  서울  인천  부산 등 타 시도의 쟁점인 통상임금 관련해서는 광주의 경우  년 상여금 등이 통상임금에  ,0,0
329,광주시  시내버스 파업 대비  비상수송대책  마련,노조는 임금   인상   정년   세에서  세로  연장  등을 요구하고 있는 반면 사측은 지난해 수준 동결 입장이다  서울 인천 부산 등 타 시도의 쟁점인 통상임금 관련해서는 광주의 경우  년 상여금 등이 통상임금에  ,0,0
330,광주시  시내버스 파업대비 비상수송대책 마련,노조는 임금   인상   정년   세에서  세로  연장  등을 요구하고 있는 반면 사측은 지난해 수준 동결 입장이다  서울  인천  부산 등 타 시도의 쟁점인 통상임금 관련해서는 광주의 경우  년 상여금 등이 통상임금에  ,0,0
331,주 일 노란봉투법 첨예한  노동 이슈 문제는 생산성 ,   정년연장  청년 일자리는   퇴직 후 재고용  노동계 반발 윤석열 정부에서 매듭짓지 못한 고령 근로자 계속고용에 대한 해법을 놓고도 두 후보는 첨예하게 맞선다  이재명 후보는 사회적 합의를 통해 현행  ,0,1
332,대전 급식조리원  쟁의  길어질 듯 석식 멈춘 학교 어쩌나,한편  양측은 지난  일부터 당직실무원  정년   세  연장  조리원 배치기준  명으로 하향  조리공정 간소화 및 노동강도 완화  상시근무자 자율연수  일 보장  방학중 비근무자 상시직 전환  직종별 고유업무 외 업무지시  ,0,0
333,  관세에  일제  도입까지  올해   임단협  역대급  예고,올해 현대차 노조의 요구안에는  정년 연장 과 국내 투자  임금 인상 및 성과급 등이 핵심 사안으로 담길 예정이다   정년 연장 은  세까지 근로 정년을 연장해달라는 것을 골자로 하며  최근 수년간 임단협 핵심 요구안  ,1,1
334,대구 경북 시내버스 노조 파업 안 한다 버스 정상운행,평균  만  원인 시급을   인상하고 만  세인  정년 을  세로의  연장 하라는 것  하지만 사측은 지난해  월 대법원에서 상여금을 통상임금으로 간주한다고 판단함에 따라 임금 자연 상승분이 생겼는데 이 문제부터  ,0,0
335, 관세 위기  중 임단협 앞둔 현대차 노사 년 무분규  위태하다,노조는 올해 임 단협에서 기본급 인상  성과급 지급 및  정년 연장  주  일제  통상임금 산입 등을 요구할 것으로 전해졌다  양측은  년부터 지난해까지  년간 파업 없는 무분규 타결 기록을 세워왔다  그러나 올해  ,0,0
336, 내일 버스 총파업  서울 부산 울산 막판 협상 진통 경기 대구  ,노조는 사측에  기본급   인상  정년 연장 세 세   퇴직금 확보  상여금 통상임금 편입  준공영제 협약 이행 등을 요구하고 있다  협상이 결렬되면  일 첫 차부터 버스 운행이 중단될 것으로 보인다  다만  ,1,0
337,노동자가 직접 뽑은 대선 노동정책 핵심   주 일제   비정규직 축소   노 ,이어  인 미만 등 모든 노동자 해고 보호 제도 적용   정년 연장  순으로 나타났다  특히 비정규직 축소의 필요성은 고용 형태에 따른 차이 없이 정규직과 비정규직 모두에서 가장 많이 응답됐다고  ,1,1
338, 파업은 안됩니다 김두겸 울산시장  시내버스 파업 자제 호소,한편  울산시내버스 노사는 지난  월  일부터 임금협상을 진행했으나  지난해  월 대법원 판결에 따른 정기상여금의 통상임금 포함 방안과 노조 측의 임금  의 임금 인상과  정년 을  세로  연장  등의 요구안을 놓고  ,0,0
339,노동자    소득 불충분 대선 노동정책  순위는  주  일제 ,이어  인 미만 등 모든 노동자 해고 보호 제도 적용   정년 연장   전 국민 고용보험제도  등을 꼽았다  불평등 해소를 위한 노동정책으로는  노조  활동 할 수 있는 권리 보장 및 지원  ,1,1
340,  대선  주  시간 예외 확대 규제 완화  김문수  기업 하기 좋 ,아울러 김 후보는 이 후보와 반대로 청년고용에 영향을 미칠 수 있다며 법정  정년 연장 에 반대한다  대신 대기업 신입 공채 도입 장려  청년 창업 지원 등 청년이 일하고 싶은 좋은 일자리를 만들겠다고 약속했다  당선 시  ,0,0
341,  대선 주  일제 시행 정년 연장  이재명  노동자 보호 권익  , 정년 연장  추진도 이 후보의 주요 공약 중 하나다  그간 고령자 고용정책으론 퇴직 후 재고용  법적  정년 연장  등 다양한 방안이 거론됐다  현 정부는 재고용 방안에 힘을 실었지만 노동계와 더불어민주당은 법적 정년  ,1,1
342,전국 시내버스노조 파업 초읽기  마지막 협상 진행 중,광주지역 버스노조는 임금   인상과  세까지  정년 연장 을 조건으로 이날 파업 찬반 투표를 실시한다  사측은 광주 시내버스 일일 수용 인원이  년  만명에서 지난해  만명까지 줄어 적자 폭 크다는 이유로 난색을  ,1,0
343, 국민의 시선   일 예고된 서울버스노조 파업  원인과 대책은 ,이 밖에도 노조는 암행감찰 폐지   정년 연장  동일노동 동일임금 실현 등을 주장했다  반면  사측인 서울시버스운송사업조합은 기존 임금체계가 상여금을 통상임금으로 보지 않는 구조였기 때문에 상여금을 반영하면 전체  ,0,0
344,대구 시내버스 노조  파업 미참여 당분간 버스 정상 운행 유지,반면 사측은 임금 동결과  정년 연장  불가 입장을 고수하고 있습니다  해당 교섭에는 대구 시내버스 업체  곳 중  곳이 참여하고 있어 파업할 경우 파급력이 클 것으로 전망됩니다  노동 당국에 따르면 파업은  ,0,0
345,한국노총 충남서부지부  민주당 이재명 후보 지지선언,어 의원은  이재명 후보는 소년공 출신으로 서민과 노동자의 고단함을 누구보다 잘 아는 사람 이라며  주  일제 도입   세  정년연장  법제화  노조 권리 보장 등 한국노총과 맺은 정책협약이 반드시 이행될 수 있도록  ,1,1
346,창원 시내버스 총파업 앞두고 막판 협상 비상수송 총력전,이날 오후  시부터 경남지방노동위원회 주관으로 노사 간 제 차 특별조정 회의에서 마지막 조정 절차가 진행 중인 가운데 노조는 현재 임금   인상   정년   세에서  세로  연장  등을 제시한 것으로 전해졌다  특히  ,0,0
347,대구 시내버스  동시다발 파업 미참여 교섭 결렬 시 검토 ,다만  시급 인상과  정년 연장  등 주요 쟁점에 대해 입장이 좁혀지지 않은 만큼  향후 협의 결과에 따라 파업에 나설 가능성도 있다고 전했습니다  경북의 경우 각 지역 시내버스 노사 대부분이 임단협 교섭에 합의를 봤고  ,1,1
348,서울 시내버스 마지막 교섭 내일 출근길 대란 오나,이와 함께 기본급   인상  운전직 호봉 상한 상향   정년 연장  하계 유급휴가 신설 등도 주요 요구안에 포함됐다  하지만 사측은 인건비 부담을 이유로 수용이 어렵다는 입장이다  서울 버스운송사업조합 관계자는  ,1,1
349,대구 시내버스 노조  파업 미참여 당분간 버스 정상운행 유지 종합 ,노사 교섭 진행 중 입장차 평행선  파업 가능성 잠재 노조  시급   인상 정년 연장 사측  수용 불가  경북도 시내버스 정상 운행 임단협 교섭 대부분 마무리   대구 연합뉴스  황수빈 기자   전국 시내버스 노조가  ,0,0
350,부산 창원 울산 광주 시내버스도 멈추나 파업 위기 속 지자체 대책 ,여기에 더해 노조는  기본급   이상  정년 연장 세 세  등을 요구 중이다  하지만 사측은 인건비 부담 등을 이유로 난색을 표하고 있다  특히 정기상여금을 통상 임금에 포함하면 법정 수당  퇴직금 등이  ,0,1
351, 준표청산   전국 최초 공무직  정년 연장  타이틀의 진실 홍준표 ,홍준표 전 대구시장이 재임 중 공언한  지자체 최초 공무직 근로자  정년 연장 이 노사 합의 과정에서 무산될 위기에 처했다  대구시는 임금피크제 없이는  정년 연장 을 할 수 없다는 입장을 고수하고  노동조합은 노사  ,1,1
352,광주 시내버스 노조 파업 투표 모레 총파업 돌입,오늘 일 부터 투표를 거쳐  내일  차 중재에서도 사측과 이견을 못하면 모레부터 총파업에 돌입할 계획입니다  노조는 기사 임금   인상과  정년   세로  연장 을 요구 중이고  회사 측은 적자를 이유로 거부하고 있습니다 ,0,1
353, 시론 일주일 남은 대선  우리가 해야 할 일,청년실업 문제를 해결할 방법과  정년연장  논의에 대한 입장도 분명히 해야 한다  연금개혁과 개헌을 비롯한 정치개혁에 대한 공약도 더욱 구체적일 필요가 있다  대선 후보들이 이런 문제들에 대한 구상을 갖고 있더라도  ,1,1
354,서울 시내버스 파업  다른 지자체 노조 동참 가능성,이에 더해  기본급   인상  정년   세로  연장   하계 유급휴가 신설  운전직 호봉 상한 상향 등을 요구하고 있다  반면 사측은 대법원 전원합의체 판결에 따라 정기상여금을 통상임금에 반영하고 노조의 인상 요구를  ,1,1
355, 대한민국 재도약  대학교육에 대한 관료적 통제 걷어내기부터  경제 , 는 이외에도  분권형 대통령제  도입과  노사 합의에 따른 자율적  정년 연장 을 제안하는 등 여타 정책 분야에도 상세하고 구체적인 정책 대안을 담고 있다  가치에 따른  장의  절의 제목 자체가 개별 정책  ,1,0
