,title,title_label,description,description_label
0, 현대삼호    임금교섭 상견례 본격 협상 돌입,0,지난  일 진행된 상견례에서 노조는 기본급  만  원 인상   정년 연장  등 조선  사 공동 요구안과 함께 휴가비 인상  야간근무자 처우 개선 등 개별 요구안을 제시했습니다  지난  분기 역대급 매출과 영업이익을  ,1
1, 시간 멈춘 부산 시내버스  임금   이상 올려 파업 풀었다,0,부산시 등에 따르면  부산 시내버스 노사는 이날 물밑 협상을 벌인 끝에 기본급   인상   정년   세에서  세로  연장  임금 체계 개편 등 임금 단체협약 합의안에 사인했다  전국의 버스 노사가 정기 상여금을  ,1
2, 사설  시민 담보로 한 버스 파업진통 되풀이 안된다,0,막판 교섭에서 노조는  시급   인상  정년  현  세에서  세로  연장   버스 준공영제 협약 이행 등의 안건을 협상 테이블에 올렸다  사측은 재정 부담 등을 이유로 노조측의 이해를 호소하다 상당 부분 양보를 했다는  ,1
3, 대선공약     모든 노동자 권리보장 기본법       중대재해처벌법  ,1, 정년 에 이른 근로자에 대해 기존 근로계약을 종료한 뒤 임금 조정 후 다시 고용하도록 하는 계속고용 방안과  주  시간제의 유연성을 강화하고자  연장 근로 단위를 확대하고 고소득 전문직 근로자를 제외하는 정책이  ,1
4,울산시내버스 노사  최종 조정 결론 도출  월  일로 연기,0,울산버스노조는 올해 임단협에서  기본급   인상  정년 연장 세 세   퇴직금 확보 방안 마련  상여금의 통상임금 편입  준공영제 협약 이행 등을 요구하고 있다  이에 대해 버스회사 측은 재정난을 이유로  ,1
5,현대차 노조 올 임단협 시작부터  험로 예고 ,0,현대자동차 노사가 올해 임금 및 단체협상을 앞둔 가운데  노조가 올해 기본급 인상과 전년도 순이익   성과급 지급   정년 연장  등을 사측에 요구하기로 했다  현대자동차 노조는  일 북구 현대차문화회관에서  ,1
6, 사설  또 멈춰선 창원 시내버스  시민 불편 가중,0,노사는 상여금  임금   정년 연장  등을 두고 접점을 찾다 협상이 결렬되면서  일 첫차부터 시내버스  개사  대의 운행이 중단된 것이다   대는 창원시내버스  에 해당한다  창원시내버스 노사는 지난해  월 대법원  ,1
7,울산 시내버스  운행중단 최악 사태는 면했다,0,노조 요구안건 중  세  정년연장 과  준공영제 협약 이행 등 다수의 제시안도 추후에 다시 협상하도록 미뤄뒀다  다만 노사는 합의안 도출 과정에서 매년 숙원으로 남겨온  미지급된 복지기금 과  미적립 퇴직연금 을  ,1
8, 사설   년 만에 멈춘 시내버스 노사 부산시 책임 통감해야,0, 정년 은 만  세로  년  연장 한다  노사는 그동안 임금   인상과 성과상여금의 통상임금 반영을 두고 견해차를 보였다  임금이 오른 만큼 부산시 부담이 커진다  부산시는 준공영제 시행으로 매년 시내버스 운영 적자를  ,1
9,연금개혁 공약 이재명  사각지대 해소    김문수  이차개혁 ,0,노인을 향해 연금 수급연령에 맞춘 법정 정년연장 을 단계적으로 추진하겠다고도 밝혔다  김문수 국민의힘 후보는  일  토론에서  국민연금 이차개혁 에 착수하겠다고 약속했다  연금개혁위원회에 청년이 참여하게 하고  ,1
10,  관세폭탄 비상인데 주  일제  꺼낸 현대차 노조,0,현대자동차 노동조합이 올해 임금 및 단체협약 임단협 에서  주  일 근무제 와  정년 연장 세 최장  세  등을 사측에 요구하기로 했다  국내에서 가장 많은 조합원을 거느린 현대차 노조가 이 카드를 꺼내자  ,1
11, 차라리  부 만들어라 과학 빠진 대선 공약 과학자들  쓴소리 ,0,위한  정년 연장  등을 적극 추진하겠다고 밝혔다  조용민 위원장은   연구개발에 필수적인   확보를 위해 외국 클라우드 기업이 한국에 데이터센터를 설립하도록 해   를 대거 투입을 유도하고  데이터 특구 조성과   ,1
12, 중도일보 독자권익위  월 정례회   대선 이후  충청권 공약이행 점검  ,0,방 위원은 대선 주요의제에 대해  일제  주 시간제 도입에 대해선 반대 입장이지만   정년연장 은 국민연금 고갈 문제로 점진적으로 시행해야 할 필요가 있다고 생각한다 면서  다만  임금은 정부 주도로 현실적인  ,1
13, 로터리  고령화 사회의 역발상,1,출산 장려책   정년 연장  사회보장 강화  외국 인력 수입 등 저출생 고령화에 대한 여러 가지 대책이 제시되고 있다  아이를 많이 낳고 잘 키워서 사회를 젊게 만들려는 노력이 필요하지만 한편으로는 우리 사회가  ,1
14,울산 시내버스 파업 보류 내달  일까지 노사합의 계속,1,노조는 기본급   인상   정년 연장 세  정기상여금의 통상임금 포함 등을 요구하고 있다  하지만 정기상여금의 통상임금 반영 여부를 두고 여전히 이견을 보여 협상에 난항을 겪었다  앞서 노조는 이날 새벽  시 분께  ,1
15,울산 시내버스 노사 교섭 시한  연장   월  일까지 정상 운행,0,노조는 올해 임단협에서  기본급   인상  정년 연장 세 세   퇴직금 확보 방안 마련  상여금의 통상임금 편입  준공영제 협약 이행 등을 요구하고 있다  회사 측은 재정 여건과 노선 운영 현실 등을 이유로  ,1
16,성과급 통상임금에 포함 첫 사례 출현에 기업들  초비상    인건비    ,1,이를 반영해 내년부터 총임금은   인상되며   정년 도  세에서  세로  년  연장 된다  이번 개편은 전국적으로 확산하고 있는 통상임금 논의에 선례로 남게 됐다  지난해  월 대법원이  정기상여금도 통상임금에  ,1
17,비상 계엄 다신 없도록  민주당  계엄권 견제 담은 대선공약 발표,0,자녀 수에 따라 분양권 환급 감면을 추진하겠다고 약속했다  이 후보의 대표적인 공약 중 하나인  일제 추진도 이번 공약집에 담겼다  또 법정  정년 을  세까지 단계적으로  연장 하는 안을 올해 중 입법 추진하겠다고 했다 ,1
18,울산 시내버스 노사   시간 마라톤 협상 마무리 내달  일 재교섭,0,특히 이날 오후 부산 시내버스 노사가 마련한 기본급   인상   세에서  세로  정년 연장  성과상여급과 하계휴가비를 폐지하고 임금체계를 개선하는 등의 내용이 합의안이 울산 시내버스 노사 협상에도 영향을  ,1
19, 이재명 공약집   정년연장  연내 입법  노동 공약 대거 추가  대선  ,1, 회복과 성장을 위한  정년연장   태스크포스 를 구성해 노사와 시민사회가 논의한 뒤 연내에 입법을 추진한다는 계획입니다  이를 위한 범정부 지원체계와 임금체계  근로시간 개선 관련한 노사자율합의 지원체계도  ,1
20,이랜드노조  비상경영 인력 전환 배치 부당 특별관리감독 필요 ,0,노조에 따르면 현재 회사 측은  정년 연장  법안 발의를 앞두고 희망퇴직을 받거나 관리직 직원들에게 물류센터로 발령을 강행하는 방식으로 구조조정을 시도하고 있다  노조는  특히  년생 관리직 직원 일부에게  ,1
21, 기본급  만원인상  요구안 전달   현대삼호 노사  올해 임금협상 돌 ,1,회사에 전달된  현대 조선 사 공동요구안에는  기본급  만 원 인상  정년 연장   성과급 산출기준 변경 등의 내용이 담겼다  이와 함께  현대삼호 노조의 개별 요구안에는  하기휴가비 인상  통상임금  ,1
22, 현대삼호 노조  기본급  만  원 인상 요구 년 임금 협상 돌입,0,회사에 전달된  현대 조선  사 공동 요구안에는  기본급  만  원 인상  정년 연장   성과급 산출기준 변경 등의 내용이 담겼다   현대삼호 노조의 개별 요구안에는  하기 휴가비 인상  통상임금 적용범위 확대  ,1
23,부산 시내버스 노사 협상 타결 오후부터 운행 재개,1,  상당 임금 인상과  정년 연장  등 합의 협상이 결렬되며 준공영제 시행 이후 처음으로 파업에 이르렀던 부산 시내버스가  시간 여만에 운행을 재개한다  한국노동조합총연맹 전국자동차노동조합연맹  ,1
24, 일 부산시  시내버스 노사협상 타결 등,0,이에 따라 실질 임금은   인상되고   정년 은 만  세에서  세로  년  연장 됐다  시는 이번 사태를 계기로 준공영제를 전면 재점검할 계획이다 부산 시내버스의 전면 파업은  년 이후  년 만이며  준공영제 도입  ,1
25, 현대삼호 노사   년 임금교섭 돌입,1,회사에 전달된  현대 조선  사 공동 요구안에는  기본급  만 원 인상  정년 연장   성과급 산출기준 변경 등의 내용이 담겼다  노조의 개별 요구안에는  하기 휴가비 인상  통상임금 적용 범위 확대  자격 면허  ,1
26,부산 버스노사 조정안 합의 버스운행 정상화,1,노사는 오늘 일  오후 재개된 협상에서  상여금과 휴가비를 없애는 대신 이를 통상임금에 반영  임금  를 인상하고  정년 은 만  세로  년  연장 하는 내용의 노동위원회 조정안에 합의했습니다  앞서 노사는 상여금의  ,1
27, 현대삼호 노사   년 임금협상 돌입,1, 현대삼호 제공 회사에 전달된  현대 조선  사 공동 요구안에는 기본급  만  원 인상   정년 연장  성과급 산출기준 변경 등의 내용이 담겼다   현대삼호 노조의 개별 요구안에는 하기 휴가비 인상  통상임금  ,1
28,부산 시내버스 노사 합의안 도출 일 오후부터 정상운행,0,성과상여금 등 폐지하고 통상임금 포함시켜 체계 개편 총액임금   인상   정년   년  연장  등 합의 부산 시내버스 노사가 임단협에 극적 합의하면서  일 첫차부터 멈춰섰던 시내버스가 운행을 재개했다  ,1
29, 관세 파고  넘기도 버거운데    성과급  천   정년   세  현대차 노조 ,0,뉴데일리 김보배 기자   현대자동차 노사가 올해 임금 및 단체협상에서 임금 인상   정년 연장  등을 두고 팽팽한 줄다리기를 할 전망이다   일 업계에 따르면 현대차 노조는 이날 오후 울산 북구 현대차문화회관에서  ,1
30,부산 버스노사 조정안 합의 버스운행 정상화,1,노사는 오늘 일  오후 재개된 협상에서  상여금과 휴가비를 없애는 대신 이를 통상임금에 반영  임금  를 인상하고  정년 은 만  세로  년  연장 하는 내용의 노동위원회 조정안에 합의했습니다  앞서 노사는 상여금의  ,1
31, 현대삼호 노사  년 임금 교섭 돌입,1,현대삼호 노동조합은 지난  일 임금 교섭을 위한 올해 첫 상견례에서 기본급  만 천  백원 인상과  정년 연장  성과급 산출기준 변경 등 조선  사 공동 요구안와 여름 휴가비 인상  통상임금 적용범위 확대  자격면허  ,1
32,  업계 임단협 출발 올해도 쉽지 않다,0,아울러 현대차노조 조합원  명 중 약  명 은 올해 단체교섭 핵심 안건인  정년연장 에 대해  임금 삭감 없는  정년연장 을 원하는 것으로 나타났다  재계에서는 노동유연성 없이  정년연장 을 할 경우 부담이  ,1
33,부산 시내버스 정상화  창원은 여전히  스톱 ,0,지난해 대법원판결에 따라 정기 상여금의 통상임금 반영  임금   인상   정년 연장  등을 두고 벌어진 협상이 결렬된 결과다  창원시는 준공영제 시행 이후 재정지원이 급증했다며 인건비 추가 부담은 수용할 수 없다는  ,1
34,부산 시내버스 노사 조정안에 합의 버스 정상 운행 재개,1,이를 반영해 임금은   인상하고   정년 은 만  세에서  세로  년  연장 한다  시내버스 노사는 그동안 월 임금   인상과 성과상여금의 통상임금 반영 등을 두고 갈등을 빚었다  노사 합의에 따라 이날 첫차부터  ,1
35, 현대삼호 노사   년 임금교섭 상견례 진행,1,회사에 전달된  현대 조선  사 공동 요구안에는  기본급  만 원 인상  정년 연장   성과급 산출 기준 변경 등의 내용이 담겼다   현대삼호 노조의 개별 요구안에는  하기 휴가비 인상  통상임금 적용 범위 확대  ,1
36, 대 대선   지속 성장  청사진 나왔다  각 후보 캠프  경제 브레인 ,0,김동명 한국노총 위원장은 노동 정책 분야에서 주  일제   정년 연장  등 노동자의 삶의 질 향상을 위한 정책 추진을 주도하고 있다  이 후보 캠프의 정책 방향과 특징으로는 우선 성장과 분배의 균형이다  경제 브레인 그룹은  ,1
37, 성장 상생을 위해 현대삼호 노사    임금교섭 개시,1,이 자리에는 김재을  현대삼호 사장과 황형수 노동조합 지회장이 함께 자리했다 회사에 전달된  현대 조선  사 공동 요구안에는  기본급  만  원 인상  정년 연장   성과급 산출기준 변경 등의 내용이 담겼다  ,1
38, 먹튀 시세조종 근절 이재명  회복 성장 행복  공약집 공개,1, 일제 추진 포괄임금제 금지 등을 근로기준법에 명문화  부부 단위 과세표준 신설  자녀 수에 따라 신용카드 소득 공제율 및 공제한도 상향  법정  정년   세로 단계적  연장   국가가 책임지고 지자체가 직접  ,1
39,부산 시내버스 파업  반나절만에 철회 노사협상 타결,1,상여금 등 통상임금에 반영 임금   인상  정년  만  세로  년  연장  부산 시내버스가 파업한지 반나절 만에 노사가 합의에 이르면서 파업을 철회했다  전국자동차노동조합연맹 부산버스노조와  ,1
40,부산 시내버스 노사  임단협 극적 타결  버스 정상운행 전환,0, 일 부산시와 부산지방노동위원회 등에 따르면  부산버스운송사업조합과 부산버스노동조합은 이날 낮  시  분께 정기상여금의 통상임금 반영   정년 연장 세  등에 합의했고 오후  시께 지노위의 조정안에 최종  ,1
41,부산 시내버스 노사 조정안 합의  버스 정상운행 재개 상보 ,1,앞서 노조 측은  임금 체계 개편  기본급   인상  정년   세에서  세로  연장  등을 요구해왔다  그러나 사측은 재정적 부담이 크다며 반대해 왔다   일 오후  시부터 시작된  차 조정 회의에서도 이들의 협상은  ,1
42, 현대삼호 노사   년 임금교섭 상견례,1,회사에 전달된  현대그룹 조선  사 공동 요구안에는  기본급  만  원 인상  정년 연장   성과급 산출기준 변경 등의 내용이 담겼다   현대삼호 노조의 개별 요구안에는  하기 휴가비 인상  통상임금 적용범위  ,1
43, 현대삼호 노사  올해 임금교섭 상견례,1,회사에 전달된  현대 조선  사 공동 요구안에는  기본급  만  원 인상  정년 연장   성과급 산출기준 변경 등의 내용이 담겼다   현대삼호 노조의 개별 요구안에는  하기 휴가비 인상  통상임금 적용범위  ,1
44,이재명  법정  정년   세로 단계적  연장 올해안 입법 추진 ,1,우선 이 후보는  회복과 성장을 위한  정년연장   를 구성해 노 사 등과 논의를 거친 뒤 국민연금 수급개시 연령 상향과 연계한 법정  정년연장 을 추진할 계획이다  현행  세인 법정 정년을 단계적으로  세까지  ,1
45,김문수 후보  대선 공약집 발간   국민과 함께 새롭게 대한민국 으로,1,커리어  연장  및 연구 공백 해소  학생 학부모 교원  공교육 내 프로젝트 기반 학습으로 공감능력 비판적   어르신  정년  후 계속고용 제도 정비 및 중장년고용정책기본법 제정으로  일하는 노년  일할 수 있는  ,1
46, 현대삼호 노사   년 임금교섭 상견례,1,회사에 전달된  현대 조선  사 공동 요구안에는  기본급  만 원 인상  정년 연장   성과급 산출기준 변경 등의 내용이 담겼다   현대삼호 노조의 개별 요구안에는  하기 휴가비 인상  통상임금 적용 범위 확대  ,1
47, 대 대선 경제아젠다 일자리   사람을 위한 노동   시장을 위한 노동 ,0,   정년 연장 과 계속고용 이 후보는 현재 만  세인 법정 정년을 국민연금 수급개시 연령에 맞춰  세까지 단계적 연장하겠다고 약속했다   년 국민연금 수급 연령이  세이고  년에  세로 올라가는 일정에 맞추어  기업  ,1
48, 현대삼호 노사   년 임금 협상 돌입,1,회사에 전달된  현대 조선  사 공동 요구안에는 기본급  만 원 인상   정년 연장  성과급 산출기준 변경 등의 내용이 담겼다   현대삼호 노조의 개별 요구안에는 하기 휴가비 인상  통상임금 적용범위 확대  자격면허  ,1
49, 현대삼호  임금교섭 시작 노조  기본급 인상 정년 연장  요구,1, 현대 조선  사 공동 요구안에는 기본급  만 원 인상   정년 연장  성과급 산출 기준 변경 등의 내용이 포함됐다  이는 그룹 내 조선 부문 공동 현안에 관한 생각을 반영한 것으로 예측된다   현대삼호 노조는  ,1
50,광주 시내버스 파업 가결 일부터 운행 중단 가능성,0,노조는 올해 임단협에서 임금   인상과  정년   세  연장  등을 요구하고 있다  전남지역 시내버스는 지난  월  일  곳이 임단협을 마무리하고 남은  곳도 타결 가능성이 높아 이번 전국 파업에는 참여하지 않을  ,1
51,앞다퉈  돈 풀기  추경  주  일제  대선 후가 더 걱정 사설 ,0,여기에 호봉제 폐지 없이  정년연장  공약까지 겹치면서 기업 부담은 가중되고 있다  시간당 노동생산성이  달러로 미국 달러  등에 비해 낮은 상황에서 노동 투입량이 줄면 잠재성장률도 급락할 수밖에 없다  ,1
52,해명 필요한   에너지 고용 주택 공약 문희수의 시론 ,1,이재명 후보는 고용 창출 계획은 없이 임금 감소 없는 주  일제  퇴직 후 재고용이 아닌 법적  정년연장 을 제시한다  특히  정년연장 은 사회적 합의를 거친다고 했지만  민주당은 한국노총과 올해 법적  정년연장 세  법안  ,1
53, 현대삼호 노사  올해 임금교섭 시작 정년연장  등 요구,1,회사에 전달된  현대 조선  사 공동 요구안에는  기본급  만 원 인상  정년 연장   성과급 산출기준 변경 등의 내용이 담겼다  또  현대삼호 노조는 개별 요구안을 통해 하기 휴가비 인상  통상임금 적용범위  ,1
54, 이재명 공약집  주  일제 추진 포괄임금제 금지 못박아  대선  ,0,제도적인 측면에서는  회복과 성장을 위한  정년연장   태스크포스 를 꾸려  이해당사자인 노사와 시민사회 논의를 거쳐 올해 안에 법정 정년을  세로 단계적 연장하는 내용의 법안을 만듭니다  이어 정규직 전환 예외  ,1
55, 현대삼호 노사 단체교섭 년 연속 연내 타결  관심 ,1,사측에 전달된  현대 조선  사 공동 요구안에는  기본급  만  원 인상  정년 연장   성과급 산출기준 변경 등의 내용이 담겼다   현대삼호 노조의 개별 요구안에는  하기 휴가비 인상  통상임금 적용범위 확대  ,1
56, 현대삼호 노사   년 임금협상 착수,1, 현대 조선  사 노조가 사측에 제시한 공동 요구안에는 기본급  만 원 인상   정년 연장  성과급 산출기준 변경 등의 내용이 포함됐다  현대삼호 노조의 개별 요구안에는 하기 휴가비 인상  통상임금 적용범위 확대  ,1
57,울산 시내버스 교섭 시한  연장  파업 잠정 보류,1,노조는 올해 임단협에서  기본급   인상  정년 연장 세 세   퇴직금 확보 방안 마련  상여금의 통상임금 편입  준공영제 협약 이행 등을 요구하고 있다  회사 측은 재정 여건과 노선 운영 현실 등을  ,1
58, 현대삼호 노사  올 임금교섭 상견례 상생  교섭 타결 청신호,1,기본급  만 원 인상   정년 연장  등 요구안 전달  현대삼호 노사가 올해 본격적인 임금 협상에 돌입했다 현대삼호는 지난  일 회사 지원관에서 김재을 사장과 노동조합 황형수 지회장을 비롯한 노사 교섭위원들이  ,1
59, 현대삼호 노사   년 임금협상 돌입,1,회사에 전달된  현대 조선  사 공동 요구안에는 기본급  만 천 원 인상   정년 연장  성과급 산출기준 변경 등의 내용이 담겼다  현대삼호 노조의 개별 요구안에는 하기 휴가비 인상  통상임금 적용범위 확대  자격  ,1
60, 현대삼호 노사 임금교섭 시작 기본급 인상 정년연장  요구,1,회사에 전달된  현대 조선  사 공동 요구안에는  기본급  만  원 인상  정년 연장   성과급 산출기준 변경 등의 내용이 담겼다   현대삼호 노조의 개별 요구안에는  하기 휴가비 인상  통상임금 적용범위  ,1
61, 현대삼호 노사   년 임금교섭 상견례,1,회사에 전달된  현대 조선  사 공동 요구안에는  기본급  만  원 인상  정년 연장   성과급 산출기준 변경 등의 내용이 담겼다   현대삼호 노조의 개별 요구안에는  하기 휴가비 인상  통상임금 적용범위 확대  ,1
62,현대차 조합원들  올해 교섭서 중요도  위는 임금   위는  정년 ,0,노조  임시대의원대회 상여금  로 인상  주  일제 도입 등 논의 국내 최대 자동차 업체인 현대자동차 노사가 올해 임금 및 단체협상에서 임금 인상과 함께  정년 연장  등을 두고 팽팽한 줄다리기를 할 것으로  ,1
63, 현대삼호 임금교섭 시작 년 연속 연내 타결 기대,1,회사에 전달된  현대 조선  사 공동 요구안에는  기본급  만 원 인상  정년 연장   성과급 산출기준 변경 등의 내용이 담겼다   현대삼호 노조의 개별 요구안에는  하기 휴가비 인상  통상임금 적용범위 확대  ,1
64,박범계  헌법연구관  정년   세  연장 헌법재판소법 개정안 발의 ,1,박범계 국회의원은  이에 헌법연구관의  정년 을  세로  연장 하여 헌법재판에 관한 지식과 경험  전문성을 갖춘 숙련된 연구 인력을 장기간 활용함으로써  헌법재판의 전문성과 신뢰성을 향상하고 사건처리의 신속성을  ,1
65, 이재명 공약집  공개  먹사니즘 잘사니즘 구체화,0,이밖에  북한 핵 위협의 단계적 감축  세종 행정수도 완성  주주 충실 의무 도입  에너지 고속도로 건설  주  일제 도입 및  정년 연장  등 각 분야 공약에 대한 이행 계획이 담길 것으로 보인다  국민의힘은 전날 김  ,1
66, 현대삼호 노사   년 임금교섭 상견례,1,회사에 전달된  현대 조선  사 공동 요구안에는  기본급  만  원 인상  정년 연장   성과급 산출기준 변경 등의 내용이 담겼다   현대삼호 노조의 개별 요구안에는  하기 휴가비 인상  통상임금 적용범위 확대  ,1
67,울산 시내버스 노사   시간째  마라톤 협상 조정기한 또  연장 ,0,노조는 사측에  기본급   인상  정년 연장 세 세   퇴직금 확보  상여금 통상임금 편입  준공영제 협약 이행 등을 요구하고 있다  특히 지난해  월 대법원의 정기상여금을 통상임금으로 봐야 한다는  ,1
68,창원 시내버스   멈춘 첫날 출근길 등굣길 시민들 발동동,0,노사는  정기 상여금의 통상임금 반영  임금   인상  정년   세 세  연장  등을 두고 협상을 벌였으나 끝내 결렬됐다  핵심 쟁점은 통상임금 부분이다  노조 요구가 수용되면 인건비가 상당히 늘어나게 된다  이에  ,1
69,노동 양극화 대선 후보들 공약은 ,0,국제노동기구에서도 다 인정하는 거라서 당연히 해야 됩니다 주  일제 도입으로  년까지 노동시간을   국가 평균 이하로 감축하고 세  정년 연장  사회적 합의 추진  포괄임금제 금지 등을 공약했습니다  ,1
70, 전세버스로 출근  창원 시내버스 멈췄다,0,노사가 갈등을 빚는 부분은 통상임금   정년 연장  부분인 것으로 알려졌습니다  창원시는 시내버스  개사 노사와 오늘 오후  시부터 협상테이블을 재가동해 대화를 이어간다는 계획입니다 ,1
71,창원 시민의 발  년 만 묶였다 일 첫차부터 파업,0,추가로 임금   인상   정년   세  연장  등도 요구했다  이에 사측은 인건비가 과도하게 인상된다며 통상임금과 임금체계 개편을 함께 논의하자고 맞서왔다  창원시는 비상수송대책을 가동해 시민 불편을 최소화  ,1
72,  대선    청년공약  청년과 노동    청년 구직활동  국 ,1,지원   정년 연장  노동 존중 사회 실현을 핵심으로 하는 일자리 노동 정책 공약을 발표했다  국가가 앞장서 적극적으로 구직활동을 지원하고  그간 윤석열 전 대통령의 거부권으로 무산됐던 각종 노동권 강화 법안을  ,1
