,title,description,title_label,description_label
708,경제 단체  신성장 구조개혁 절실  김문수  기업하기 좋은 나라 만들 ,손경식 경총 회장은 법정  정년 연장 과 관련해  호봉제를 고려할 때 일률적인 법정  정년 연장 은 고령 인력에 대한 부담을 더욱 높여 청년층 신규 채용 기회를 축소할 것 이라며  퇴직 후 재고용 방식을 통해 세대 간 균형을  ,0,1
709,이재명  국가가 삶을 책임지는 기본사회 구축 복지 패러다임 전환 , 정년 연장 은 사회적 합의를 전제로 추진하고  상병수당을 단계적으로 확대해 아프면 쉴 수 있는 권리도 제도화하겠다고 밝혔다   교통 디지털 접근성 확대 기회의 차단 없앤다  지역 간 이동 격차와 디지털 접근성  ,1,1
710,이재명 기본사회 김문수 정치개혁 이준석 단일화 거부,주  일제 단계적 도입과  정년 연장  추진  공공 필수 지역 의료를 강화하겠다는 공약과 함께  사회 전체가 함께 돌보는 돌봄 기본사회를 추진하겠다고 약속했습니다  이렇게 기본사회 구상을 밝힌 이재명 후보는 오전에  ,1,1
711, 뉴스퀘어   단일화 대가  당권 제안설  의혹 파장,대목  대목마다 들어가 있는 정책들이  일제 근무라든가  정년연장  문제라든가 이런 얘기가 나와서요  지난번 이거 가지고 이준석 후보하고 토론회에서 쟁점이 되기도 했었죠  당시 그런 게 나왔을 때 이재명 후보 입장은  ,0,1
712,경제 단체  김문수 후보 만나  신성장 동력 구조개혁 절실 ,손경식 회장은 일률적인 법정  정년 연장 의 부작용을 우려하며  퇴직 후 재고용 방식을 통해 세대 간 균형을 도모하는 정책 검토가 필요하다 고 전했다  이어 하청 근로자에 대한 원청 책임을 강화하는 노조법  조 개정안  ,0,0
713,김문수 만난 경제 단체  경제 경고등 신성장 동력 구조개혁 필요 ,손경식 회장은 법정  정년 연장 과 관련해  호봉제를 고려할 때 일률적인 법정  정년 연장 은 고령 인력에 대한 부담을 더욱 높여 청년층 신규 채용 기회를 축소할 것 이라며  퇴직 후 재고용 방식을 통해 세대 간 균형을  ,1,1
714, 대 대선공약  노동 정년연장     단계적 추진 확대     기업 노 ,노동 분야 주요 쟁점  주 시간 일 정년연장     노동시간    평균 이하로 정년은 연장     기업하기 좋은 나라  기업 노조에 자율권 부여   아시아타임즈 최태용 기자  이재명 더불어민주당 대선후보와 김문수  ,1,0
715,김문수  대통령실에 기업 민원 전담 수석 두겠다 ,손 회장은  정년 연장 과 근로 시간 문제에 대한 제언을 남겼습니다  손 회장은  정년 연장 보다 퇴직 후 재고용 방식을 통해 고용 확대와 세대 간 균형을 도모할 수 있는 정책 검토가 필요하다 며  일제 논의는 기업들에  ,1,1
716,김문수 만난 경제 단체  신성장 구조개혁 절실 ,손경식 경총 회장은 법정  정년 연장 에 대해  호봉제를 고려할 때 일률적인 법정  정년 연장 은 고령 인력에 대한  기업의  부담을 더욱 높여 청년층 신규 채용 기회를 축소할 것 이라며  퇴직 후 재고용 방식을 통해 세대  ,1,1
717, 대 대선  김문수 만난 최태원  일본과 경제연대  제시,손경식 경총 회장은  여전히 많은 기업들이 호봉제를 운영하는 상황을 감안할 때 일률적인 법정  정년 연장 은 청년 신규 채용 기회를 축소시킬 것 이라며  퇴직 후 재고용 방식을 통해 고령자 고용 확대와 세대 간  ,0,1
718,경제 단체  신성장 동력 구조 개혁 시급 김문수  기업 민원 전담 ,손경식 한국경영자총협회 회장은  호봉제를 고려할 때 일률적인 법정  정년 연장 은 고령 인력에 대한 부담을 더욱 높여 청년층 신규 채용 기회를 축소할 것 이라고 지적했다  이어  제조업이나 첨단산업에선 업종 특성과  ,1,1
719,김문수 만난 경제계  경제 경고등   신성장 구조개혁 절실 ,특히 대선 후보들의 공약에 포함된  정년 연장 과 주  일제 도입에 대한 우려도 함께 전했다  김문수 후보는 불필요한 규제를 철폐해 기업하기 좋은 나라를 만들겠다고 공언했다  대한상공회의소는  일 한국경영자총협회  ,1,0
720,이재명  기본사회위 설치  김문수  대통령  년 중임제 개헌 , 정년 연장 도 사회적 합의로 추진할 것 이라고 밝혔다  이 후보는 또 아동수당 지급 대상을 확대하겠다고 약속하며  청년미래적금 을 도입해 청년의 자산 형성과 사회 진입을 지원하겠다 며  모두의 존엄한 노후를 위해  ,1,1
721,우리가 주 일제 반대  조선 문화일보 기사에  노조  새로고침  줄탈퇴,보수언론에서 새로고침노동자협의회가 주  일제와  정년연장 에 사실상 반대한다는 보도가 잇달아 나온 가운데  협의회 소속이었던 노조들은 동의하지 않는 내용이 거듭 기사화되고 있다며 줄탈퇴가 이어지고 있다는  ,0,0
722,국민연금 신 구연금 분리는 공적연금 본연의 기능 훼손,한국노총과 더불어민주당은  일 목  오후  시  분 국회의원회관  세미나실에서 진행한  백세시대 소득보장 실천단  정책협약 및 지지선언에서  신 구 연금 분리 반대를 비롯하여  년 내  세  정년연장  입법 추진  ,0,1
723,경제 단체장 만난 김문수  기업 민원 전담수석 두겠다 ,손경식 회장은  정년 연장   일제 도입  노란봉투법 등에 우려를 나타내며  노사 자율성을 존중하고  기업이 경쟁력을 회복할 수 있는 제도 개선이 절실하다 고 강조했다  윤진식 회장은 미국의 상호관세 부활 가능성에  ,1,0
724,재계 만난 김문수  노란봉투법 대신  기업민원 수석 신설 ,손경식 한국경총 회장은 법정  정년 연장  방식 대신 퇴직 후 재고용 방식을 통한 일자리 창출을 제안했다  아울러 주 일제  노란봉투법은 기업에 부담이 될 수 있다며 우려를 전달했다  윤진식 무역협회 회장은 신뢰에  ,1,0
725,경제 단체  김문수 후보 간담회  경제  구조개혁 절실 ,손경식 경총 회장은 법정  정년 연장 과 관련해  호봉제를 고려할 때 일률적인 법정  정년 연장 은 고령 인력에 대한 부담을 더욱 높여 청년층 신규 채용 기회를 축소할 것 이라며  퇴직 후 재고용 방식을 통해 세대 간 균형을  ,0,1
726,대전교육청  급식 차질 부른 비정규직 직종교섭 재개,노조 측의 직종교섭 주요 요구안은 당직실무원  정년 연장  조리원 배치기준 하향  조리공정 간소화 및 노동강도 완화  방학중 비근무자 상시직 전환  직종별 고유업무 외 업무지시 금지 등이다  교육청 관계자는  교섭이  ,1,0
727,김문수 만난 경제  단체  정치권과 적극적 소통,손경식 한국경영자총협회 회장은  정년 연장 과  일제 도입 등에 대해 우려를 표했다  윤진식 한국무역협회 회장은 트럼프 대통령의 관세 정책에 대한 우려를 표하며 신뢰 기반의 유연한 통상 전략이 필요하다고 제언했다  ,1,0
728, 대선   김문수  기업 민원 전담수석 두겠다 경제계  규제혁신 ,손경식 회장은  정년 연장   일제 도입  노란봉투법 등에 우려를 나타내며  노사 자율성을 존중하고  기업이 경쟁력을 회복할 수 있는 제도 개선이 절실하다 고 강조했다  윤진식 회장은 미국의 상호관세 부활 가능성에  ,1,0
729,김문수 만난 경제  단체장  경제 경고등 신성장 구조개혁 절실 ,손경식 경총 회장은 법정 정년 연장 과 관련해  호봉제를 고려할 때 일률적인 법정 정년 연장 은 고령인력에 대한 부담을 더욱 높여 청년층 신규채용 기회를 축소할 것 이라며  퇴직후 재고용 방식을 통해 세대간 균형을  ,1,1
730,경제 단체  한일 연대 인재  만 유입  제언   김문수  기업 민원 전 ,손 회장은  많은 기업이 호봉제 운영을 감안할 때 일률적인 법적 정년연장 은 임금 부담을 너무 높여 청년 채용 기회를 축소한다 고 덧붙였다  또  주  시간제 일괄 적용으로 산업 현장의 유연성이 떨어졌다 며 주  일제  ,0,1
731,경제 단체  김문수 국민의힘 대선후보 간담회 개최,사회적 논쟁거리가 되고 있는  퇴직 후 재고용을 통한 고령자 고용 연장 에 대해서는  정년  이후 고령자의 재고용을 통한 고용  연장 과 고령인력 활용에 대한 기업 부담을 줄이기 위한 정부지원을 제안했다  근로시간 단축  ,1,1
732,이재명   포괄복지 기본사회  재점화   일제 정년연장  추진 , 정년 연장 은 사회적 합의를 거쳐 추진하고 고용형태와 소득 수준에 관계없이 고용보험과 육아휴직을 활용할 수 있도록 제도 사각지대를 해소하겠다고 약속했다  또  아프면 쉴 권리 를 보장하는 상병수당도 단계적으로  ,1,1
733,김문수  경제  단체장  제언  청취   정부  기업 도울 책임 있다 ,손경식 회장은 법정 정년연장 과 근로시간 유연화  노란봉투법에 대해 발언했다  기업 대부분이 호봉제를 운영하고 있는 상황에서 일률적인 법적 정년연장 은 청년층의 신규 채용 기회를 줄이고 노동시장의 이중구조를  ,1,1
734,최태원  과 경제연대 필요 재계  김문수 후보에 제언,손경식 회장은  정년 연장 과 주  일제 도입에 우려를 표하며 민간에 자율성을 부여해야 한다고 주장했다  손 회장은  국내외 모든 기관이 성장률 전망을 하향 조정한 어려운 상황에서 기업 활력을 되살릴 정책적 뒷받침이  ,1,0
735, 대선  이재명  기본사회 실현   기본사회위원회  설치 공약,근로 환경 개선 방안으로는 주  일제 도입   정년 연장  고용보험 육아휴직 사각지대 보완  상병수당 확대 등이 제시됐다  교통 분야에선 지역 맞춤형 교통 서비스 확대  청년 국민패스 확대  교통약자 대상 특별교통수단  ,1,0
736,이재명  제주 경남으로 김문수 각종 간담회,이어 주  일제 단계적 도입과 사회적 합의를 통한  정년 연장  공공 의료 기관 설치 확대와  대 돌봄 국가 책임제 실현 등 공약도 내놨습니다   앵커  국민의힘 김문수 후보는 정치개혁 공약 기자회견을 진행한 뒤 연이어  ,1,1
737,이재명   커피  원  논란 속  기본사회  또 꺼내   안철수  미래 인질 , 정년연장 을 사회적 합의로 추진하겠다 고 했다  안철수 국민의힘 공동선거대책위원장은 이날 페이스북을 통해 이 후보의 기본소득 등의 공약에 대해  이재명식  질러노믹스 는 감당할 수 없는 포퓰리즘 이라며  ,1,1
738,김문수  기업하기 좋은 나라 만들겠다 기업 민원 전담수석 둘 것 ,손 회장은  정년 연장 과 주  일제 도입에 우려를 표하며 민간에 자율성을 부여해야 한다고 목소리를 높였다  그는  국내외 모든 기관이 성장률 전망을 하향 조정한 어려운 상황에서 기업 활력을 되살릴 정책적 뒷받침이  ,1,0
739,대전시교육청  학비연대 직종교섭 재개 당직실무원 우선 교섭,대전시교육청 전경  사진 뉴스핌  주요 교섭 요구안 내용은  당직실무원  정년   세  연장 조리원 배치기준  명으로 하향 조리공정 간소화 및 노동강도 완화 상시근무자 자율연수  일 보장 방학중 비근무자 상시직  ,1,0
740, 기업하기 좋은 나라  외치는 김문수에  제언 쏟아낸 경제 단체장,손경식 회장은  정년 연장  문제는 퇴직 후 재고용 방식으로 풀어나가야 하고  근로시간을 유연화해 경쟁력을 확보해야 한다고 강조했다  손 회장은  많은 기업이 호봉제를 운영하는데  일률적인 법적  정년 연장 은 기존 고령  ,0,0
741,김문수 만난 경제 단체  새 성장동력과 구조개혁 절실 ,   공동취재   연합뉴스  손경식 경총 회장은 법정  정년 연장 과 관련해  호봉제를 고려할 때 일률적인 법정  정년 연장 은 고령 인력에 대한 부담을 더욱 높여 청년층 신규 채용 기회를 축소할 것 이라며  퇴직 후  ,1,1
742,이재명 기본사회 구상  돌봄 기초학력 직업교육 방점,이 후보는  일과 삶이 균형 잡힌 사회를 만들겠다 며  주 일제 단계적 도입  정년연장  사회적 합의 추진  고용보험과 육아휴직 제도의 사각지대 보완  아프면 쉴 권리 인 상병수당 시범사업 단계적 확대도 약속했다 ,1,1
743,재계  김문수 후보에 한일 경제연대 대미 통상전략 등 제언 종합 ,특히 대선 후보들의 공약에 포함된  정년 연장  및 주  일제 도입에 대한 경제계의 우려도 함께 전했다  대한상의는  일 한국경영자총협회 한국경제인협회 한국무역협회 한국중견기업연합회와 공동으로 김문수 후보  ,0,1
744,김문수 만난 경제 단체  경제 경고등 신성장 구조개혁 절실 종합 ,손경식 경총 회장은 법정  정년 연장 과 관련해  호봉제를 고려할 때 일률적인 법정  정년 연장 은 고령 인력에 대한 부담을 더욱 높여 청년층 신규 채용 기회를 축소할 것 이라며  퇴직 후 재고용 방식을 통해 세대 간 균형을  ,1,1
745,김문수  자유로운 투자 환경 조성해야 기업 민원 전담 수석 신설 ,손 회장은 근로시간 유연화와  정년 연장  대신 재고용 제도를 검토할 것을 제안했고  윤 회장은 수출 규제 대응과 중소기업 지원 확대를 요청했다  최 회장은  상속세 증여세 문제를 해결하지 않으면 중견기업의 해외  ,1,0
746,민주당  주요 국정과제  국민 참여 공론화위원회  추진,주요 의제로는 의료개혁  교육   정년연장  등 정부나 전문가 주도로 의사를 결정할 경우 국민 갈등이 더욱 확산될 가능성이 있는 것들이 꼽힌다  이 후보는 보건의료 분야 공약을 통해  국민 참여형 의료개혁  ,0,1
747,이재명  기본사회 실현 국가전담기구 설치 ,일과 삶 균형을 위해선 주  일제 단계적 도입  실노동시간 단축 로드맵 추진 등을 내놨다   정년연장 을 사회적 합의로 추진하되 상병수당 시범사업을 단계적으로 확대하겠다고 약속했다 ,1,0
748, 대 대선  이재명  국가가 삶 책임질 것 작은 정부  지향 김문수와 ,특히 노동정책과 관련해서도 이 후보는 노동시간 단축과  정년 연장 을 주장하고 있지만  김 후보는  정년 연장 보다는 임금 체계 개편과 노동시장 유연화를 강조하며 기업 경쟁력을 중시한다는 차이를 보이고 있다 ,1,1
749,이재명  기본사회  제안 주  일제와 복지 확대 정책 발표,이 후보는 일과 삶의 균형을 실현하기 위해 주  일제의 점진적 도입과 노동 시간 단축 계획  그리고 사회적 합의를 기반으로 한  정년 연장  추진을 강조했다  아울러 생애주기별 소득 보장 체제를 강화하고  아동수당 지급  ,0,0
750,이재명  기본사회위원회 설치 일제 정년연장  추진 ,주  일제의 단계적 도입과 실노동시간 단축을 위한 로드맵을 추진하고   정년 연장 도 사회적 합의를 통해 도입하겠다는 입장이다  생애주기별 소득 보장 체계도 강화하겠다고 밝혔다  아동수당 지급 대상을 넓히고  청년  ,0,1
751, 기본사회  꺼낸 이재명 기본사회위원회 설치 기본적 삶  실질적  ,주  일제 도입과  정년 연장 을 사회적 합의를 통해 추진하고  상병수당 확대  육아휴직 사각지대 해소 등을 통해 일과 삶의 균형을 이루겠다고 강조했다  아울러 지역 간 이동격차 해소를 위해 지역 실정에 따른 맞춤형 교통  ,1,1
752, 세    세  노인연령 상한 논란  복지차관  합의통해 점차 올려야 ,그렇게 해가지고  정년 이  연장 된 거거든요  그래서 우리도 점차 우리 어르신들이 이렇게  에 퇴직하지 말고 일을 더 하시고 또 노인 연령 같은 경우도 점차 사회적 합의를 통해서 점차 이렇게 올려가야 되지 않을까 그런  ,0,1
753,대전 학교 급식 재개될까  대전교육청  노조와  직종교섭  재개,한편 노조의 주요 교섭 요구안 내용은 당직실무원  정년   세  연장  조리원 배치기준  명으로 하향  조리공정 간소화 및 노동강도 완화  상시근무자 자율연수  일 보장  방학중 비근무자 상시직 전환  직종별 고유업무 외  ,1,0
754,김문수  대통령실에 기업 소통 창구 최태원  한일경제연합 제안 ,   기업환경 악화하면서 경제 살리겠다는 건 거짓말  경제계   정년연장 주  일제  기업에 부담  제언 김문수 후보 간담회  인사말하는 최태원 회장 서울 연합뉴스  황광모 기자   최태원 대한상의 회장이  일 서울 중구  ,1,1
755,김문수 만난 최태원   연합  재차 강조 합치면  조달러 ,손경식 경총 회장은 법정  정년 연장 에 대해 반대하는 의견을 내면서 대신 퇴직 후 재고용 방식을 제안했다  또한 주  일제 등이 기업에 부담이 된다는 점  노란봉투법에 대한 우려 등을 언급했다  윤진식 무협 회장은  ,0,0
756,이재명  기본사회  다시 꺼냈다 전담기구 주 일제도  종합 , 정년 연장 도 사회적 논의를 거쳐 추진하겠다고 했다  또 고용형태나 소득 수준에 관계없이 누구나 고용보험과 육아휴직을 활용할 수 있도록 하고   아프면 쉴 수 있는 권리 인 상병수당도 단계적으로 확대하겠다는  ,1,1
757,천하람  함익병  대 룸살롱  발언  개인적 경험 일반화 사과해야   이 ,김문수도 원하고 있을 듯   내일 두 번째   토론 이준석의 전략은  국민연금 이슈 같은 것들 언급을 할 것이라고 생각   정년 연장 하면 청년 취업에 악영향 있는 거 아닌가    차기 대통령  왜 이준석이어야 하나  ,1,1
758,김문수  이재명  기업환경 악화시켜 경제 살린다  거짓말 ,이 외에도 참석자들은 건설경기 부진 탈출을 위한 랜드마크 건설 및 스타트업 투자 확대  일괄적인 법정  정년연장  및 노란봉투법 반대  근로시간유연화 확대  상속세 축소와 근로자 과표 구간 상향 등을 요구했다 ,1,0
759, 선택   이재명   기본사회  제시 국민의힘  퍼주기 결과는 빚더미 , 일제 단계적 도입  정년연장  사회적 합의 추진  대도시 광역권 청년 국민패스로 교통비 부담 완화  통신비 지원 등을 제시했다  이같은 세부 방안을 추진하려면 대규모 재정 투입은 불가피하다  앞서 이재명  ,1,1
760,이재명   기본사회  공약 발표   일제 도입 정년연장  추진,특히 이 후보는 일과 삶의 균형 잡힌 사회를 만들겠다며  주  일제 단계적 도입 과  정년연장  추진  등을 제시했다  이 후보는 이날 자신의 페이스북을 통해  주거 의료 돌봄 교육 공공서비스 같은 삶의 모든 영역에서  ,0,1
761, 기본사회  대전환 이재명  국가가 생애 전 주기 삶 보장하겠다 ,이 후보는  생산성이 높아진 만큼  주  일제 등 실노동시간 단축을 추진해 일과 삶의 균형을 이루겠다 며  상병수당과  정년 연장  고용보험 사각지대 해소로 고용 돌봄 권리를 강화하겠다 고 밝혔다  끝으로 이 후보는  ,1,0
762, 현장연결  이재명  기본사회 김문수  증시 이준석  공무원 ,더불어민주당 이재명 후보는  일제와  정년연장  등을 담은 기본사회공약을 발표했습니다  국민의힘 김문수 후보는 거래소와 대한상의를 잇달아 방문하며 경제 행보를  이준석 개혁신당 후보는 공무원들을 만났는데요  ,0,0
763,이재명  기본사회  설치 주  일제 정년연장 , 정년연장 을 사회적 합의로 추진하겠다 고 밝혔다  또한  고용보험과 육아휴직 제도의 사각지대를 지속적으로 보완하겠다 며  아프면 쉴 권리 인 상병수당 시범사업을 단계적으로 확대하겠다 고 약속했다  이  ,1,1
764,이재명  기본사회  국가전담기구 설치할 것 , 일과 삶의 균형 과 관련해선  정년 연장 을 사회적 합의로 추진하겠다면서  주  일제 단계적 도입과 실노동시간 단축 로드맵을 추진해  일하는 권리도 쉴 권리도 당연히 존중받는 사회를 만들겠다 고 말했다  또  아프면 쉴  ,1,1
765,이재명 주거 의료 돌봄 포괄한 기본사회 공약 발표   기본 튼튼한 나 ,일과 삶이 균형잡힌 사회를 만들기 위해  주  일제 와  정년연장  고용보험과 육아휴직 제도의 사각지대 보완   아프면 쉴 권리 인 상병수당 시범사업의 확대도 단계적으로 추진하겠다고 밝혔다  주거 분야와 관련해서는  ,1,1
766, 오늘의 주요 정치 일정  국회 월 일 목요일 , 차   대미 의원 외교 의원회관 제 간담회의실    박홍배 의원실 등  초고령사회  노후소득 공백 해결을 위한  정년연장  어떻게 할 것인가 의원회관 제 세미나실    김동아 의원실 등  신자본시장의 공정한  ,1,1
767,   기본사회  설치 일제 정년연장 공공의료확충 추진 , 정년 연장 도 사회적 합의로 추진할 것 이라고 밝혔습니다  이 후보는 또  태어날 때부터 노후까지 생애주기별 소득 보장 체계를 촘촘히 구축할 것 이라며  아동수당 지급 대상을 단계적으로 확대하고 청년 미래 적금을  ,1,1
768,대전교육청  학교비정규직연대회의와 직종교섭 재개,주요 교섭 요구안 내용은 당직실무원  정년   세  연장  조리원 배치기준  명으로 하향  조리공정 간소화 및 노동강도 완화  상시근무자 자율연수  일 보장  방학중 비근무자 상시직 전환  직종별 고유업무 외 업무지시  ,1,0
769,이재명  국민 기본 삶  국가가 책임   전담기구  기본사회위원회  설치 ,아울러 이 후보는  일과 삶이 균형 잡힌 사회 를 만들겠다면서  주  일제 도입과 실노동시간 단축 로드맵   정년 연장  사회적 합의  상병 수당 확대 등을 통해 일과 삶의 균형을 이루겠다 고 했다  또  아프면 쉴 권리 인  ,1,1
770,대전교육청  학교비정규직연대회의와 직종교섭 재개,주요 교섭 요구안 내용은 당직실무원  정년   세  연장  조리원 배치기준  명으로 하향  조리공정 간소화 및 노동강도 완화  상시근무자 자율연수  일 보장  방학중 비근무자 상시직 전환  직종별 고유업무 외 업무지시  ,1,0
771,이재명  주거 의료 돌봄 교육과 쉴 권리 보장된  기본사회 로  기본사 , 정년연장  논의도 사회적 합의를 통해 본격적으로 추진하겠다는 입장이다  이 후보는  고령사회에 진입한 지금  일하고 싶은 사람이 일할 수 있는 제도를 만들어야 한다 며  노동시장에서의 배제가 아니라  연령에 상관없이  ,1,1
772,이재명  기본사회 국가전담기구 설치   국민의 삶  국가 공동체가 책 ,이와 함께 주  일제 단계적 도입과  정년연장  공약도 제시하며  주  일제 단계적 도입과 실노동시간 단축 로드맵을 추진해 일하는 권리도 쉴 권리도 당연히 존중받는 사회를 만들겠다 며  정년연장 을 사회적 합의로  ,1,1
773,사전투표    기본사회  설치     국회의원수   감축 , 정년 연장 도 사회적 합의로 추진할 것 이라고 밝혔다  국민의힘 김문수 대선 후보는 국회의원 정수   감축  야당이 추천하는 특별감찰관 임명 등을 골자로 하는  정치개혁  공약을 발표했다  또 의회의 권력 남용을 막기  ,1,1
774,이재명  기본사회 구상 발표   복지 넘는 구조적 전환 ,이 후보는 주  일제 도입과 실노동시간 단축 로드맵   정년연장  상병수당 확대 등 노동권 보장 정책도 제시했다  또한 맞춤형 지역 교통 서비스 확대  교통약자 특별교통수단 확충  통신비 지원  공공데이터 개방과   활용  ,0,0
775,대전교육청  학교 비정규직 직종 교섭 재개 당직 실무원부터 시작,노조의 주요 요구는  당직 실무원  정년   세  연장   조리원 배치 기준  명으로 하향  조리 공정 간소화  자율연수  일 보장  방학 중 비근무자 상시직 전환  고유업무 외 지시 금지 등이다  교육청은 조리원을 우선  ,1,0
776,이재명  기본사회위원회 설치 주  일제 정년연장  추진 ,이어  정년연장 을 사회적 합의로 추진하겠다 고 덧붙였습니다  이 후보는 또  태어날 때부터 노후까지 생애주기별 소득 보장 체계를 촘촘히 구축하겠다 며  아동 수당 지급 대상을 단계적으로 확대하고   청년미래적금 을  ,0,1
