,title,title_label,description,description_label
353,김문수  대통령실에 기업 소통 창구 최태원  한일경제연합 제안 ,1,   기업환경 악화하면서 경제 살리겠다는 건 거짓말  경제계   정년연장 주  일제  기업에 부담  제언 김문수 후보 간담회  인사말하는 최태원 회장 서울 연합뉴스  황광모 기자   최태원 대한상의 회장이  일 서울 중구  ,1
354,이재명  기본사회  다시 꺼냈다 전담기구 주 일제도  종합 ,1, 정년 연장 도 사회적 논의를 거쳐 추진하겠다고 했다  또 고용형태나 소득 수준에 관계없이 누구나 고용보험과 육아휴직을 활용할 수 있도록 하고   아프면 쉴 수 있는 권리 인 상병수당도 단계적으로 확대하겠다는  ,1
355,천하람  함익병  대 룸살롱  발언  개인적 경험 일반화 사과해야   이 ,1,김문수도 원하고 있을 듯   내일 두 번째   토론 이준석의 전략은  국민연금 이슈 같은 것들 언급을 할 것이라고 생각   정년 연장 하면 청년 취업에 악영향 있는 거 아닌가    차기 대통령  왜 이준석이어야 하나  ,1
356, 선택   이재명   기본사회  제시 국민의힘  퍼주기 결과는 빚더미 ,1, 일제 단계적 도입  정년연장  사회적 합의 추진  대도시 광역권 청년 국민패스로 교통비 부담 완화  통신비 지원 등을 제시했다  이같은 세부 방안을 추진하려면 대규모 재정 투입은 불가피하다  앞서 이재명  ,1
357,이재명   기본사회  공약 발표   일제 도입 정년연장  추진,0,특히 이 후보는 일과 삶의 균형 잡힌 사회를 만들겠다며  주  일제 단계적 도입 과  정년연장  추진  등을 제시했다  이 후보는 이날 자신의 페이스북을 통해  주거 의료 돌봄 교육 공공서비스 같은 삶의 모든 영역에서  ,1
358,이재명  기본사회  설치 주  일제 정년연장 ,1, 정년연장 을 사회적 합의로 추진하겠다 고 밝혔다  또한  고용보험과 육아휴직 제도의 사각지대를 지속적으로 보완하겠다 며  아프면 쉴 권리 인 상병수당 시범사업을 단계적으로 확대하겠다 고 약속했다  이  ,1
359,이재명  기본사회  국가전담기구 설치할 것 ,1, 일과 삶의 균형 과 관련해선  정년 연장 을 사회적 합의로 추진하겠다면서  주  일제 단계적 도입과 실노동시간 단축 로드맵을 추진해  일하는 권리도 쉴 권리도 당연히 존중받는 사회를 만들겠다 고 말했다  또  아프면 쉴  ,1
360,이재명 주거 의료 돌봄 포괄한 기본사회 공약 발표   기본 튼튼한 나 ,1,일과 삶이 균형잡힌 사회를 만들기 위해  주  일제 와  정년연장  고용보험과 육아휴직 제도의 사각지대 보완   아프면 쉴 권리 인 상병수당 시범사업의 확대도 단계적으로 추진하겠다고 밝혔다  주거 분야와 관련해서는  ,1
361, 오늘의 주요 정치 일정  국회 월 일 목요일 ,1, 차   대미 의원 외교 의원회관 제 간담회의실    박홍배 의원실 등  초고령사회  노후소득 공백 해결을 위한  정년연장  어떻게 할 것인가 의원회관 제 세미나실    김동아 의원실 등  신자본시장의 공정한  ,1
362,   기본사회  설치 일제 정년연장 공공의료확충 추진 ,1, 정년 연장 도 사회적 합의로 추진할 것 이라고 밝혔습니다  이 후보는 또  태어날 때부터 노후까지 생애주기별 소득 보장 체계를 촘촘히 구축할 것 이라며  아동수당 지급 대상을 단계적으로 확대하고 청년 미래 적금을  ,1
363,이재명  국민 기본 삶  국가가 책임   전담기구  기본사회위원회  설치 ,1,아울러 이 후보는  일과 삶이 균형 잡힌 사회 를 만들겠다면서  주  일제 도입과 실노동시간 단축 로드맵   정년 연장  사회적 합의  상병 수당 확대 등을 통해 일과 삶의 균형을 이루겠다 고 했다  또  아프면 쉴 권리 인  ,1
364,이재명  주거 의료 돌봄 교육과 쉴 권리 보장된  기본사회 로  기본사 ,1, 정년연장  논의도 사회적 합의를 통해 본격적으로 추진하겠다는 입장이다  이 후보는  고령사회에 진입한 지금  일하고 싶은 사람이 일할 수 있는 제도를 만들어야 한다 며  노동시장에서의 배제가 아니라  연령에 상관없이  ,1
365,이재명  기본사회 국가전담기구 설치   국민의 삶  국가 공동체가 책 ,1,이와 함께 주  일제 단계적 도입과  정년연장  공약도 제시하며  주  일제 단계적 도입과 실노동시간 단축 로드맵을 추진해 일하는 권리도 쉴 권리도 당연히 존중받는 사회를 만들겠다 며  정년연장 을 사회적 합의로  ,1
366,사전투표    기본사회  설치     국회의원수   감축 ,1, 정년 연장 도 사회적 합의로 추진할 것 이라고 밝혔다  국민의힘 김문수 대선 후보는 국회의원 정수   감축  야당이 추천하는 특별감찰관 임명 등을 골자로 하는  정치개혁  공약을 발표했다  또 의회의 권력 남용을 막기  ,1
367,이재명  기본사회위원회 설치 주  일제 정년연장  추진 ,0,이어  정년연장 을 사회적 합의로 추진하겠다 고 덧붙였습니다  이 후보는 또  태어날 때부터 노후까지 생애주기별 소득 보장 체계를 촘촘히 구축하겠다 며  아동 수당 지급 대상을 단계적으로 확대하고   청년미래적금 을  ,1
368, 이재명 후보  공공의료 확충 필수의료 강화 ,1, 일제 정년연장 지역 소득지원 등 병행 추진 보건의료 외에도 이 후보는 생애주기별 소득보장  노동시간 단축  교육 돌봄 정책 강화 등  기본사회  구현을 위한 다층적인 정책을 함께 제시했다  그는  일과 삶의  ,1
369,이재명  기본사회위원회  설치 일제 정년연장 공공의료확충,1, 정년 연장 도 사회적 합의로 추진할 것 이라고 밝혔다 또  태어날 때부터 노후까지 생애주기별 소득 보장 체계를 촘촘히 구축할 것 이라며  아동수당 지급 대상을 단계적으로 확대하고 청년 미래 적금을 도입해 청년들을  ,1
370,이재명  대선후보 첫 제주 양산 집중유세 후   추도식,0,이 후보는 생애주기별 소득보장체계와 공공 필수 지역 의료 강화  돌봄 기본사회  주  일제 단계적 도입  사회적 합의를 통한  정년연장  통신비 지원 등의 복지 정책 방향을 소개했다 ,1
371,이재명  기본사회위원회 설치  김문수  정치 판갈이 ,0,이 후보는 특히  일과 삶이 균형이 잡힌 사회를 만들겠다 며  주  일제 단계적 도입과 실노동 시간 단축 로드맵을 추진하고  정년 연장 도 사회적 합의로 추진할 것 이라고 밝혔습니다  국민의힘 김문수 후보는  정치  ,1
372,경제 단체   김문수 국민의힘 대선후보 간담회  개최 경제위기 극복 ,1,손경식 경총 회장은 법정  정년 연장 과 관련해  호봉제를 고려할 때 일률적인 법정  정년 연장 은 고령 인력에 대한 부담을 더욱 높여 청년층 신규 채용 기회를 축소할 것 이라며  퇴직 후 재고용 방식을 통해 세대 간 균형을  ,1
373,이재명  기본사회  건설 위한 국가전담기구 설치 국민 삶 국가 책임 ,1,또한  워라밸 일과 삶의 균형  공약으로는  정년연장 과 주  일제를 내놨다  그는  정년연장 의 사회적 합의와 추진을 강조하며  주  일제 단계적 도입과 실노동시간 단축 로드맵을 추진해  일하는 권리도 쉴 권리도 당연히  ,1
374,이재명표 기본사회 공약 주  일제 정년 연장 공공의료 강화   대선 ,1, 정년 연장 도 사회적 합의로 추진할 것 이라고 밝혔습니다  이 후보는 또  태어날 때부터 노후까지 생애주기별 소득 보장 체계를 촘촘히 구축할 것 이라며  아동수당 지급 대상을 단계적으로 확대하고 청년 미래 적금을  ,1
375,이재명  기본사회로 간다  기본사회위 설치 주  일제 공약,1,또한 이 후보는 일과 삶의 균형을 강조하며 주  일제의 단계적 도입  실노동시간 단축 로드맵 추진   정년 연장 에 대한 사회적 합의를 제안했다  생애주기별 소득보장 체계도 강화하겠다고 밝혔다  아동수당 지급 대상의  ,1
376, 연합뉴스 이 시각 헤드라인     ,1,     기본사회  설치 일제 정년연장 공공의료확충 추진  더불어민주당 이재명 대선 후보는  일  국민의 기본적인 삶은 국가 공동체가 책임지는 사회  기본 사회로 나아가겠다 며  기본사회위원회 를  ,1
377,   기본사회  설치 일제 정년연장 공공의료확충 추진 ,1, 정년 연장 도 사회적 합의로 추진할 것 이라고 밝혔다  이 후보는 또  태어날 때부터 노후까지 생애주기별 소득 보장 체계를 촘촘히 구축할 것 이라며  아동수당 지급 대상을 단계적으로 확대하고 청년 미래 적금을 도입해  ,1
378,이재명  기본사회위원회 설치 일제 정년연장  추진 ,0, 정년 연장 도 사회적 합의로 추진할 것 이라고 언급했다  이어  태어날 때부터 노후까지 생애주기별 소득 보장 체계를 촘촘히 구축할 것 이라며  아동수당 지급 대상을 단계적으로 확대하고 청년 미래 적금을 도입해  ,1
379, 대권풍향계  이재명   기본사회위원회  신설 공약 주  일제와  정년   ,0,그는  국가 공동체가 국민의 기본적인 삶을 책임지는 사회로 나아가겠다 며 이를 통해 주  일제와  정년 연장 을 추진하겠다고 밝혔다  이재명 후보는 자신의 페이스북을 통해  기본사회는 단순한 복지나 소득 분배를 넘어  ,1
380,이재명   기본사회위원회  설치 공약   일제 정년연장 공공의 ,1, 정년 연장 도 사회적 합의로 추진할 것 이라고 밝혔다  이 후보는 또  태어날 때부터 노후까지 생애주기별 소득 보장 체계를 촘촘히 구축할 것 이라며  아동수당 지급 대상을 단계적으로 확대하고 청년 미래 적금을 도입해  ,1
381,이재명  기본사회  설치   국가가 국민의 기본 삶 보장할 것 ,1, 일제 정년연장 공공의료확충 추진 단편적 복지 소득분배 이상 기본적 삶 보장 아동수당 지급 확대 농어촌 기본소득 등 공약  시장경제 노경민 기자  더불어민주당 이재명 대선 후보가  일 자신의 지역구인 인천광역시  ,1
382,   기본사회위원회 설치 일제 공공의료확충 추진 ,0, 정년 연장 도 사회적 합의로 추진할 것 이라고 했다  의료정책에 대해서는  민간 중심 의료 공급으로 지역 격차 및 필수 의료 공백 사태가 심각한 상황 이라며  공공 필수 지역 의료를 강화하겠다 고 설명했다 ,1
383,이재명 기본사회 공약 기본소득 패키지 전방위 국가책임제,1,주거는 청년과 어르신도 적정한 비용을 부담하는 맞춤형 공공분양과 공공임대 주택 공급을 확대하고  노동 환경 개선을 위해선 주 일제 단계적 도입을 비롯한 실노동시간 단축 로드맵과  정년연장  사회적 합의를  ,1
384,이재명  기본사회  만들고  일제 연금개혁 공공의료 강화 추진 ,0, 정년 연장 도 사회적 합의로 추진할 것 이라고 밝혔다  이 후보는 또  태어날 때부터 노후까지 생애주기별 소득 보장 체계를 촘촘히 구축할 것 이라며  아동수당 지급 대상을 단계적으로 확대하고 청년 미래 적금을  ,1
385, 기본사회  다시 꺼낸 이재명 모두 함께 잘 사는 세상 만들겠다 ,1, 정년연장 을 위한 사회적 합의  고용보험의 사각지대 해소에도 나서겠다고 밝혔다  공공의료 강화도 공약했다  이 후보는  의료의 공공성을 높이고  공공 의료 인력을 확충해 모두가 동등하게 치료받을 수 있는 기반을  ,1
386,이재명  기본사회위원회 설치 일제 및 공공 필수 지역 의료 강화 ,1, 정년 연장 도 사회적 합의로 추진할 것 이라며  고용보험과 육아휴직 제도의 사각지대를 지속적으로 보완해 고용형태나 소득 수준에 상관없이 누구나 일할 권리를 보장받도록 하겠다 고 말했다  이 후보는 또  태어날 때부터  ,1
387,이재명  전 생애 기본사회  국가가 책임  공공분양 지역화폐 확대 ,1,이어  정년연장 을 사회적 합의로 추진하겠다 며  아프면 쉴 권리 인 상병수당 시범사업을 단계적으로 확대해 모두에게 더 두터운 사회적 안전망을 제공하겠다 고 했다 ,1
388,   기본사회  설치 일제 정년연장 공공의료확충 추진 ,1, 정년 연장 도 사회적 합의로 추진할 것 이라고 밝혔다  이 후보는 또  태어날 때부터 노후까지 생애주기별 소득 보장 체계를 촘촘히 구축할 것 이라며  아동수당 지급 대상을 단계적으로 확대하고 청년 미래 적금을 도입해  ,1
389, 오늘의 국회 년  월  일,1, 차   대미 의원 외교 의원회관 제 간담회의실    박홍배 의원실 등  초고령사회  노후소득 공백 해결을 위한  정년연장  어떻게 할 것인가 의원회관 제 세미나실    김동아 의원실 등  신자본시장의 공정한  ,1
390,이재명  기본사회로 나갈 것 일제 정년연장 공공의료확충 ,1, 정년 연장 도 사회적 합의로 추진할 것 이라고 약속했다  이 후보는 또  태어날 때부터 노후까지 생애주기별 소득 보장 체계를 촘촘히 구축할 것 이라며  아동수당 지급 대상을 단계적으로 확대하고 청년 미래 적금을 도입해  ,1
391, 속보 이재명  기본사회위원회 설치 국민 삶 실질적 보장 ,1,특히  일과 삶의 균형이 잡힌 사회 를 위해  주  일제의 단계적 도입과 실노동 시간 단축 로드맵을 추진하고   정년 연장 도 사회적 합의를 바탕으로 추진할 것 이라고 덧붙였다  소득 보장 대책으로는  태어날 때부터  ,1
392, 기본사회  다시 꺼낸 이재명  기본사회위 설치  주  일제 지역화 ,1, 정년 연장 은 사회적 합의를 통해 추진하겠다고 밝혔다  또 고용보험과 육아휴직 제도의 사각지대를 보완하고   아프면 쉴 권리 인 상병수당 시범 사업도 단계적으로 확대하겠다는 계획이다  공공서비스 부문에서는 교통  ,1
393,이재명  생애 소득 보장하는 기본사회 만들겠다 ,0,또한  주  일제 단계적 도입과 실노동시간 단축 로드맵을 추진해  일하는 권리도 쉴 권리도 당연히 존중받는 사회를 만들겠다 며  정년연장 을 사회적 합의로 추진하겠다 고 했다  그는  국가가 국민의 미래를 책임지고  ,1
394,이재명  국가 사회 함께 책임지는 기본사회 열 것 국가전담기구 설치 ,1,확대해 유통과 사용 편의성을 높이고 전통시장과 골목상권의 활력을 되찾겠다 고 덧붙였다 이외에도 이 후보는  돌봄 기본사회 추진  주 일제 단계적 도입  정년연장  사회적 합의 추진 등의 공약을 내놨다  김동욱,1
395,이재명  국민 삶  국가가 책임 전담기구  기본사회위원회  설치 ,1,아울러 이 후보는  일과 삶이 균형 잡힌 사회 를 만들겠다면서  주  일제 도입과 실노동시간 단축 로드맵   정년 연장  사회적 합의  상병 수당 확대 등을 통해 일과 삶의 균형을 이루겠다 고 했다  또  아프면 쉴 권리 인  ,1
396,이재명  기본사회 공약 발표 생애소득 보장 공공의료 주 일제 ,1,여기에  정년연장  사회적 합의  상병수당 확대  고용보험 사각지대 해소 등을 통해 누구나 일하고  돌보고  쉴 수 있는 사회를 만들겠다는 의지도 내비쳤습니다  이 외에도 이 후보는  돌봄 기본사회  구축과 농어촌 맞춤형  ,1
397,이재명  기본사회  공약 내놨다   국가전담기구 설치 ,1, 정년 연장 은 사회적 합의를 거쳐 추진하고 고용보험 육아휴직 제도 사각지대 해소   아프면 쉴 권리 인 상병수당 확대 등으로 일할 권리와 쉴 권리를 모두 보장하겠다고 약속했다  누구나 편리하게 이동하고 자유롭게  ,1
398,이재명  국가가 국민의 기본 삶 보장해야 국가전담기구 설치 ,1, 일과 삶의 균형 과 관련해서는  정년연장 을 사회적 합의로 추진하겠다면서  주  일제 단계적 도입과 실노동시간 단축 로드맵을 추진해  일하는 권리도 쉴 권리도 당연히 존중받는 사회를 만들겠다 고 말했다  또  ,1
399,이재명  기본사회 정책 발표,1, 일제 도입과  정년 연장 을 사회적 합의로 추진하고  생애주기별 소득 보장 체계를 구축할 계획이다  아동수당 대상 확대와 청년 미래 적금 도입  특수고용직 고용보험 확대를 공약했다  공공의료 강화와 돌봄 기본사회  ,1
400,이재명  주거 교통 의료돌봄 교육 등  기본사회  공약 발표,1,그는  정년연장  사회적 합의 추진  고용보험과 육아휴직 제도 사각지대 보완  상병수당 시범사업 확대를 말했다  그는  누구나 편리하게 이동하고  자유롭게 연결되는 사회를 만들겠다 며  지역실정에 따른 맞춤형 교통  ,1
401,이재명  기본사회 실현 위한 국가전담기구 설치 ,1, 정년연장 도 사회적 합의에 따라 추진하겠다고 밝혔다  의료분야에서는 공공 필수 지역의료 강화를 제시했다  주택 분야에서는 맞춤형 공공분양과 고품질 공공임대 주택 공급 확대 등 수요자 중심의 다양한 유형의 주택  ,1
402,기본사회 전면에 꺼내든 이재명 생애별 소득보장부터 주거   까지 ,1, 정년연장 과 관련해서도 사회적 합의로 추진 의사를 밝혔다  고용보험과 육아휴직 제도의 사각지대 보완  상병수당 시범사업 확대 등도 약속했다  공공서비스와 관련해서도 기본사회의 개념을 적용하겠다고 약속했다  이  ,1
403, 사회적 대화 변하지 않으면  노사 갈등으로 진짜  잃어버린  년  올 수 ,1,그 사이 한국노총은  계속고용 의제를 새 정부 출범 이후로 미룬다 며 입장을 바꿨습니다      한국노총은 더불어민주당의  정년연장  태스크포스 에 합류했습니다  정무적 판단을 한 것으로 보이는데요    ,1
404,이재명  기본사회위원회 둘 것 주 일 정년연장  추진 ,0,이 후보는  일과 삶이 균형 잡힌 사회를 만들겠다 며  주 일제 단계적 도입  정년연장  사회적 합의 추진  고용보험과 육아휴직 제도의 사각지대 보완  아프면 쉴 권리 인 상병수당 시범사업 단계적 확대도  ,1
405,   기본사회  설치 일제 정년연장 공공의료확충 추진 ,1, 정년 연장 도 사회적 합의로 추진할 것 이라고 밝혔다  이 후보는 또  태어날 때부터 노후까지 생애주기별 소득 보장 체계를 촘촘히 구축할 것 이라며  아동수당 지급 대상을 단계적으로 확대하고 청년 미래 적금을 도입해  ,1
406,  대선  이재명  기본사회위 설치 주 일제 단계적 도입 ,0, 정년연장  사회적 합의 추진과 고용보험 및 육아휴직 제도 사각지대 보완  상병수당 확대 등도 함께 제시됐다  가장 눈에 띄는 공약 중 하나는  주  일제  단계적 도입이다  이 후보는   등 기술로 높아진 생산성은  ,1
407,이재명  기본소득 뺀  기본사회  공약 제시 국가전담기구 신설 종합 ,1,주  일제  단계적 도입 실노동시간 단축 로드맵 추진  정년연장  사회적 합의로 추진 맞춤형 공공분양 고품질 공공임대 주택 공급 확대  서울 연합인포맥스  정지서 기자   더불어민주당 이재명 대선 후보가 국가와  ,1
408,이재명  기본사회  국가전담기구 설치할 것 국민 기본 삶 국가가 책임 ,1, 일과 삶의 균형 과 관련해서는  정년연장 을 사회적 합의로 추진하겠다면서  주  일제 단계적 도입과 실노동시간 단축 로드맵을 추진해  일하는 권리도 쉴 권리도 당연히 존중받는 사회를 만들겠다 고 말했다  또  아프면  ,1
409,이재명  기본사회  꺼냈다 민관협력으로 국민 삶 책임질것 ,1, 정년 연장 은 사회적 합의를 통해 추진하겠다고 밝혔다  또 고용보험과 육아휴직 제도의 사각지대를 보완하고   아프면 쉴 권리 인 상병수당 시범사업도 단계적으로 확대하겠다는 계획이다  공공서비스 부문에서는 교통  ,1
410,이재명  기본사회 공약 국가가 국민 삶 책임 ,1,노동 정책에서는 주  일제 도입과  정년 연장 에 대한 사회적 합의를 추진하고  상병수당 확대를 통해 일과 삶의 균형을 실현하겠다고 약속했다  교통 통신 등 연결망 평등을 위한 정책도 포함됐다  교통 취약지역 맞춤형  ,1
411,이재명  기본사회 나아갈 것 국가전담기구 설치 ,1,그러면서  정년연장 을 사회적 합의로 추진하겠다   아프면 쉴 권리 인 상병수당 시범사업을 단계적으로 확대해 모두에게 더 두터운 사회적 안전망을 제공하겠다 고 했다  이어 지역간 연결되는 사회를 위해  지역  ,1
412,이재명  기본사회 공약  발표 정년연장 의료 주택 확장 등,1,이재명 후보는  정년연장 을 사회적 합의로 추진 하겠다고도 밝혔다  그러면서 그는  고용보험과 육아휴직 제도의 사각지대를 지속적으로 보완해 고용 형태나 소득 수준에 상관없이 누구나 일할 권리와 돌볼 권리를  ,1
413,이재명  국민 기본적인 삶  국가가 책임 기본사회로 ,1,그러면서  정년연장 을 사회적 합의로 추진하겠다   아프면 쉴 권리 인 상병수당 시범사업을 단계적으로 확대해 모두에게 더 두터운 사회적 안전망을 제공하겠다 고 했다  또 공공 필수 지역 의료를 강화하겠다고 약속했다  ,1
414, 세    세  노인연령 상한 논란  복지차관  합의통해 점차 올려야 ,0,그렇게 해가지고  정년 이  연장 된 거거든요  그래서 우리도 점차 우리 어르신들이 이렇게  에 퇴직하지 말고 일을 더 하시고 또 노인 연령 같은 경우도 점차 사회적 합의를 통해서 점차 이렇게 올려가야 되지 않을까 그런  ,1
415, 오늘의 국회일정   년  월  일,1, 차   대미 의원 외교 의원회관 제 간담회의실    박홍배 의원실 등  초고령사회  노후소득 공백 해결을 위한  정년연장  어떻게 할 것인가 의원회관 제 세미나실    김동아 의원실 등  신자본시장의 공정한  ,1
416, 사회대전환  노동   평범한 하루를 위해 우리에게 필요한 것,1,이런 문제를 해결하고자 국민연금 수급연령과 연계한  정년연장 은 선택이 아닌 필수로 여겨지고 있다  초고령화 사회 진입을 코앞에 두고 있고  국민  명 중  명 이상이  세까지 단계적 법정  정년연장 에 찬성한다  ,1
417,조선 사절단 실은 미 대륙횡단 열차와 미국 언론,0,이후 센트럴은  년  월에 샌프란시스코 만의 오클랜드 까지  연장 하였다  유니온은  년  평소 역사에 관심이 많아 역사서를 많이 읽었으며  계명대에서  정년  퇴임한 후 구한말 근세사를 집중 연구하고  ,1
418, 월 일 주요일정  제 회 전국시도교육감협의회,0, 차   대미 의원 외교  의원회관 제 간담회의실  박홍배 의원실 등  초고령사회  노후소득 공백 해결을 위한  정년연장  어떻게 할 것인가  의원회관 제 세미나실  김동아 의원실 등  신자본시장의 공정한  ,1
419, 오늘의 국회일정 일 목 ,0, 차   대미 의원 외교  의원회관 제 간담회의실  박홍배 의원실 등  초고령사회  노후소득 공백 해결을 위한  정년연장  어떻게 할 것인가  의원회관 제 세미나실  김동아 의원실 등  신자본시장의 공정한  ,1
420, 오늘의 국회일정  우원식 의장    사태 홈플러스노조 면담 ,0, 차   대미 의원 외교 의원회관 제 간담회의실    박홍배 의원실 등  초고령사회  노후소득 공백 해결을 위한  정년연장  어떻게 할 것인가 의원회관 제 세미나실    김동아 의원실 등  신자본시장의 공정한  ,1
421, 유연한 고용  연장 으로 청년 채용  투자 여력 챙겨야 ,0,다만 의무적인  정년 연장 보다는 성과 직무를 기반으로 한 임금피크제 활용이 인건비 절감 등 효율성을 높이는 방법이 될 것으로 봤다  그는  연공급 체계 호봉제 가 그대로일 때 일괄적으로 정년을 연장할 경우 연간  ,1
422, 오늘의 국회일정   일  목 ,0, 차   대미 의원 외교 의원회관 제 간담회의실    박홍배 의원실 등  초고령사회  노후소득 공백 해결을 위한  정년연장  어떻게 할 것인가 의원회관 제 세미나실    김동아 의원실 등  신자본시장의 공정한  ,1
