,title,description,title_label,description_label
498,막 오른 포스코 임단협  성과 화합 두 마리 토끼 잡을까,노조의  년 교섭 요구안 주요 내용은  기본급 인상  철강경쟁력 강화 공헌금    자사주  주 지급  정년 연장   의료비 지원 제도 신설 등 일시금 항목  가지와 임금성 항목  가지  단체협약 갱신 항목  가지  ,0,0
499,민주당이 불붙인  재판소원 법조계 안팎  오히려 국민 권리 구제  ,박범계 민주당 의원은 지난  일 헌법연구관  정년 을  세에서  세로  연장 하는 방안을 내놨다  앞서 민주당은 지난  일 법원 판결의 위헌 여부를 헌법재판소가 판단할 수 있도록 하는  재판소원  관련 헌법재판소법  ,0,1
500,소비 부진에 자영업도 줄폐업 인구 감소로 내수 회복 난망,카페 패스트푸드 음식점 호프 줄줄이 감소  년  세 이상 고령층 비중   돌파 전문가  내수 부진 만성화 막기 위해  정년 연장  논의 시급  아주경제 권성진 기자   지난  월 서울 중구 황학동  ,0,1
501, 주  일제 정년연장  공약 엇갈린 반응,사진   더불어민주당   조기 대선 국면에서  주  일제 정년연장  관련 공약이 발표되자 엇갈린 반응이 나오고 있다  지역 노동계는 환영하는 반면  지역 중소기업계는 부작용을 우려한다  임금 삭감 합의도 쉽지 않을  ,0,0
502, 년생 정년은  세 덴마크 의회   정년 연장 ,메테 프레데릭센 덴마크 총리도 지난해  우리는 더 이상  정년 이 자동으로  연장 되어야 한다고 생각하지 않는다 며  사람들에게 계속해서  년 더 일해야 한다고 말할 순 없다 고 말했다  덴마크의 이웃 나라인  ,0,1
503, 년생부터는  정년   세 연금 수령 시기 늦춘 이 나라,이번 조치로 덴마크는 유럽에서  정년  연령이 가장 높은 국가가 됐다  이웃국가인 스웨덴에서는  세부터  메테 프레데릭센 덴마크 총리는  더 이상 은퇴 연령이 자동으로  연장 돼야 한다고 생각하지 않는다 며  ,1,0
504, 오늘의 그래픽 일하는 노인  만명 세까지 출근 희망 ,고령 취업자들이 원하는 근로희망연령도 갈수록 높아지고 있어  퇴직 후 재고용이나  정년 연장 에 대한 논의를 본격적으로 추진해야 한다는 목소리가 나오고 있다 ,0,0
505,호황이 후폭풍으로 현대 한화오션 임단협 전망  흐림 ,사측은 불과  년 전만 해도 조선업이 불황이었던 만큼  그동안 노조의  정년연장  요구를 거부할 명분이 충분했지만 올해는 투자 확대 외 내세울 이유가 없다  심지어 유력 대선주자인 이재명 더불어민주당 후보도  ,1,0
506,근로자 정부   기업 시장  달랐던  청년고용 해법도 이견 분야 ,예를 들어 이 후보가 약속한 법정  정년 연장 은 대기업 공공 부문만 혜택을 받고 청년 일자리 부족을 심각하게 만들 수 있다는 비판이 따라붙는다   정년 연장 이 되면 기업마다 고령자 고용 비용이 늘어나면서 청년 채용  ,1,0
507, 인간은 언제까지 일해야 하나    덴마크  정년   세  후폭풍 확산 속  ,뉴데일리 홍승빈 기자   덴마크에서 정년을  세로 연장하는 법안이 통과되면서 국내에서도  정년 연장  문제가 재조명받고 있다  청년 일자리 부족이 사회문제로 떠오른 현실을 외면할 순 없지만  세계적인 정년  ,1,1
508, 년생은  세까지 일해라 정년 연장 에 난리난 이 나라,최근 몇주 수도 코펜하겐에서는  정년 연장 에 반대하는 노동조합의 시위가 벌어졌다  노조는  연금 수령 연령을 늘리는 것은  완전 불공평하다 고 주장했다  이어  덴마크는 건강한 경제를 갖고 있지만  ,1,0
509, 언제까지 일만 하란 말이냐 정년   세  연장 에 노동자 화났다,덴마크 의회가 은퇴 연령을 유럽 국가 중 최고인  세로  연장 하는 법안을 통과시키면서 노동계에서  도대체 언제까지 일을 하란 말이냐 며 반발이 터져나오고 있다고 영국  방송이  일 현지시간  보도했다  덴마크는  ,0,0
510, 만 명 일하는 고령사회 세까지 일하고 싶다   정년 연장  논의 급 ,고령 취업자가 급증하면서  정년 연장 과 재고용 논의가 사회적 과제로 떠오르고 있다 일 통계청 국가통계포털에 따르면  년  월 기준  세 이상 취업자는  만  명으로 전년 대비  만 명  증가하며 역대  ,0,1
511,덴마크   정년   세로  연장  노동계는 반발,메테 프레데릭센 덴마크 총리도 지난해  우리는 더이상  정년 이 자동적으로  연장 되어야 한다고 생각하지 않는다 며  사람들에게 계속해서  년 더 일해야 한다고 말할 순 없다 고 말했다 ,0,1
512, 로펌 핫스폿  노동법 대응의 든든한 파트너 광장 컴플라이언스팀,중대재해처벌법   정년 연장  통상임금  최저임금 확대 적용 등 다양한 노동 관련 이슈가 등장해 기업들이 경영에 어려움을 겪고 있는 가운데 법률 자문과 소송 대응까지 한번에 해결할 수 있는 법무법인 광장의  ,1,1
513, 대선 공약 비교    후보별 대선후보 저출산 고령화 대책  전문가  신 ,노후 소득 보장체계 구축을 위해서는 국민연금 수급 연령에 맞춰  정년 연장 을 단계적으로 추진하고 주택연금 제도를 개선해 노후 소득을 보장하겠다고 밝혔다  김 후보 역시 노인 돌봄 체계 구축을 강조했다  사회 서비스형  ,0,0
514, 세 이상 일하는 노인  만명 시대 세까지 일하고 싶어 ,고령 취업자들이 원하는 근로희망연령도 갈수록 높아지고 있어  퇴직 후 재고용이나  정년 연장 에 대한 논의를 본격적으로 추진해야 한다는 목소리가 나오고 있다   일 통계청 국가통계포털 에 따르면  월  ,0,1
515,서울 시내버스 파업 여부 이번주 결론  극적 타결  촉각 ,이 밖에도  운전직 호봉 상한 상향 호봉 호봉   정년  만  세  연장 현행 만  세   하계 유급휴가  일 신설  고용안정협약 체결 등이 노조 측 요구안이다  양측은 조건부 임금동결안 등을 포함해  종류의 협상  ,0,0
516, 행복의 나라  덴마크도  정년   세  연장 일할 수 있다  환호 ,게티이미지뱅크 영국  는  일 현지시간  덴마크 의회가  정년 연장  법안을 찬성  표  반대  표로 통과시켰다고 보도했다  현재 정년 연령은  살이지만   년에는  살   년에는  살로 높아질 예정이다   살  ,1,1
517,주  일제    시간 개선 갈라진 노동 해법,법정  정년 연장 은 청년 고용에 영향을 줄 수 있다며 반대하고 있는데  이재명 후보와 가장 각을 세우는 방향은 역시  노란봉투법  재추진 여부입니다   김문수   국민의힘 대선후보   사실 헌법에도 안 맞고 이거는 민법에도  ,0,1
518,덴마크  연금받는 은퇴연령  세로  연장 블루칼라 강력반대,한국에서 논의되는  정년연장 의 성격과 이를 둘러싼 논란과 달리 유럽에서는 연금을 받을 수 있는 은퇴연령의 연장에 대해 노동자들이 강하게 반대하는 상황이다  특히 프랑스에서는 에마뉘엘 마크롱 정부가 지난  ,0,1
519, 년생부터 은퇴연령  세로  연장   언제까지 일하나  반발 나온 이 ,덴마크 고용부장관은 이와 관련  미래 세대에 적절한 복지를 제공하기 위해선  정년 연장 이 필요하다 고 설명했다  덴마크 인구수는 약  만명으로  이 중  세 사이 인구는 약  만 명   세 사이의 인구는  ,0,1
520, 년 수정 경제전망과 정책적 시사점,또한 중장기적인 노동 공급 감소 추세에 대응하기 위해 고령층의 노동시장 참여를 촉진하기 위한  정년연장  형태 및 보수 결정 체계에 대한 사회적 합의를 도출하는 한편  생산 공정의 자동화와 디지털화를 통해  ,1,1
521, 정책포커스  노인의 사회적 고립  고독과 미충족 돌봄 대응책 마련해야,정부는  노인연령 단계적 조정 세 과  정년 연장  논의를 준비하고 있으며 사회적 의견 수렴을 위해 전문가 간담회 등을 추진해나갈 예정이다 라고 밝혔다  노인 우울증  치매 자살 돌봄 체계와 연계해  ,1,0
522,재판 소원부터 대법관 증원까지 사법부 지각변동 생기나,박 의원이 같은 날 발의한 헌법재판소법 개정안은 헌법연구관  정년 을 현행  세에서  세로  연장 하는 내용이다  민주당은 지난  일에도 법원 판결의 위헌 여부까지 헌재가 판단할 수 있도록 하는 헌법재판소법 일부  ,1,1
523,지역 내 연이어 이재명 후보 지지 선언, 일제 도입  비전형 노동자 권리 보호  포괄임금제 폐지  법적  정년연장  등 정책을 공약으로 제시했다 고 밝혔다  한편 지역 내 단체들의 지지선언 이외에도 정책간담회를 통해 협약식도 이어지고 있다  어기구 의원은  ,0,0
524,근로시간 정년 최저임금 차이 확연한 노동정책 로드맵,노동계는 크게 반발하는 가운데 한국노총과 정책협약을 맺은 이재명 후보 측은  사회적 논의가 더 필요하다 는 입장을 밝혔습니다  연합뉴스  김유아입니다   이재명  이준석  김문수  최저임금  정년연장   유연근무,0,1
525, 대선 중간점검  경제엔 한목소리  노동 에너지 권력개편은 제각각,이외 이재명 후보의 노동분야 기타 주요 공약으로는  포괄임금제 금지 명문화  정년   세까지 단계적  연장   근로감독관 증원 및 지방공무원에 특사경 권한 부여  중대재해처벌법 유지 등이 있다  반면 김문수 후보는  ,0,0
526, 를 위한 국가경영  대 공약 보고서  이근면의 시사라떼 , 정년연장  및 노동개혁 노동 인구 감소 시대에 생산가능 인구를 활용하지 못하면 국가경쟁력은 붕괴된다  정년  세로 단계적 재고용  성과 중심 임금 체계 도입  산업별 직무별 유연근무제를 확대 하여 고령층 빈곤 해소  ,1,0
527,경사노위  계속고용  이중구조 해소에 오히려 도움 노동계 주장 반 , 일 노동계에 따르면 주요 노동단체는 전날 국회 의원회관에서  정년연장  국회 토론회 를 열고 경사노위가 제시한 계속고용의무제를 비판했다  토론회에서 발제를 맡은 정흥준 서울과학기술대 경영학과 교수는  ,1,1
528, 사회  토론인데 네거티브로 시작해 끝난  진흙탕 싸움 영상 ,민주노동당 권영국 후보는  정년 을  세에서  세로  연장 하는 노동개혁과 더불어 국민연금 실질 가입기간을 늘리는 방식으로 소득대체율을 높이자는 대안을 제시했다  한편  이날 출연한 후보들 중 유일하게 차별금지법  ,0,1
529,이재명  모수개혁  안 한 것보다 낫다  김문수  연금 자동조정장치  ,이런 우려를 해소할 수 있는 가장 적극적인 장치가 자동조정장치다  이재명 자동조정장치를 도입하면 연금 내는 사람이 불안해서 연금에 대한 신뢰가 깨질 것 같다  권영국 정년 을  세로  연장 하고  국민연금의  ,0,1
530,이재명  연금개혁 안 한 것보다 낫다 이준석  숫자만 바꾼 가짜개혁 ,권 후보는  정년 을  세에서  세로  연장 하고  그 기간만큼 국민연금 가입기간을 늘리면 실질적으로 소득대체율이 증가하는 효과가 발생한다 고 설명했다  또  전체 군복무 기간을 연금 가입기간으로 산입하고  자녀  ,0,1
531, 위클립   월  주,이어  사측이 변명으로 책임을 회피하기보다 빠른 인정과 사과에 나서야 한다 고 촉구함    초고령사회  노후 소득 공백 해결을 위한  정년 연장  어떻게 할 것인가  토론회    관련기사   계속고용 의무제  정년 이중구조  ,0,1
532, 사설  한국노총과 갑자기  정년   세  합의했다는 민주당,핵심은  연내  세  정년 연장  입법 추진 이다  아무리 선거판이 달아올라도 경제 산업계에 엄청난 파장을 몰고 올 방안을 이렇게 느닷없이 합의해도 되는지 납득이 안 된다  이번 협약은  국민연금 수급 연령과  ,0,0
533,이준석  요양병원 간병비 급여화에  조 이재명  허용 범위서 하자 ,권영국 후보는  정년 을  살로  연장 하고 이 기간을 국민연금 가입기간으로 늘리게 되면 실질적으로 가입기간이 늘어나 소득대체율이 그만큼 증가하는 효과가 발생한다 고 말했다 ,0,1
534,이재명  연금제도는 세대 간 연대    이준석  젊은 세대 손해 ,권영국 민주노동당 후보는  정년 을  세에서  세로  연장 하고  그 기간을 국민연금 가입 기간으로 늘리면 실질적으로 연금 가입 기간이 늘어남에 따라 소득대체액이 그만큼 증가하는 효과가 발생한다 고 제안했다 ,1,1
535,종교인들 만난    통합이 우선  갈등 위기 극복할 것 ,김 후보가 이날 내놓은 고령층 공약 핵심은 기업들이  정년 을  연장 하거나  정년 을 넘긴 직원을 재고용하는 방식으로 고용을 이어가도록 정부가 유도하는 내용이다  김 후보는 또  중장년 고용 정책 기본법 을  ,1,0
536, 대선   차  토론  기초연금 올려야   재정 한계 복지 연금  ,권 후보는  세 이상은 신규 취업 시 고용보험 적용이 안 된다 며  국가인권위에서도 연장 적용을 권고한 바 있다 고 지적했고  이 후보는  정년 연장  연금 개시 연령 등 복합적 문제와 얽혀 있어 신중한 접근이 필요하다  ,0,0
537, 연금개혁  충돌 이재명  모수개혁  지금보다 낫다 인정해야 ,권영국 민주노동당 대선 후보는  정년 연장 과 국민 연금의 연동 방안을 제시했다  그는  정년을  세에서  세로 연장하고 그 기간을 국민연금 가입 기간으로 늘리면 실질적으로 연금 가입 기간이 늘어남에 따라  ,1,1
538, 대선 후보  차   토론  김문수  이재명  퇴직연금 의무화 외상센터 ,김 후보의 질문에 권영국 민주노동당 후보는  연금 소득 대체율을 높이기 위해서는  정년 을 현행  세에서  세로  연장 해 국민연금 가입 기간을 늘리는  구조 개혁 이 우선 이라고 맞받아쳤다  권 후보는  가입 기간이  ,0,1
539,박범계   비법조인 대법관법  이어  헌법연구관  정년연장 법 도 발의, 일 정치권에 따르면 국회 법제사법위원회 야당 간사를 맡고 있는 박범계 민주당 의원은 헌법연구관  정년연장  법안을 이날 대표발의했다  헌법연구관은 헌법재판관을 보좌하면서 헌법재판 사건의 심리 및 심판에 관한  ,1,1
540,민주   대법관 자격 완화 헌법연구관  정년연장 법  동시 추진,그러면서  헌법연구관의  정년 을  세로  연장 해 헌법재판에 관한 지식과 경험  전문성을 갖춘 숙련된 연구 인력을 장기관 활용함으로써  헌법재판의 전문성과 신뢰성을 향상하고 사건 처리의 신속성을 향상하고자 한다  ,1,1
541, 단도직입  이재명 김문수 격차  한 자릿수 로 어떻게 보나,이준석 후보의 호텔경제학이나 또는  정년연장  이런 부분에 대해서는 사실 참 우리 민주당과 이재명 후보의 입장이 국민들에게 제대로 전달이 안 되는 것 같아서 좀 안타까운 면은 있습니다  사실 호텔경제학은 재정으로  ,0,1
542, 년 만의 총파업 대란 오나  광주 시내버스  차 조정 결렬,노조는 최저생계비에 준하는 월급  인상과  세까지  정년 연장 을 요구하고 있다  노조는 조합원 찬반 투표를 마친 뒤 오는  일  차 중재에서도 노사 간 이견을 좁히지 못할 경우 이튿날부터 파업에 돌입한다  파업이  ,1,0
543,민주당 한노총  연내  정년   세  입법 합의,이재명 민주당 대선 후보는 지난  일  정년 연장 에 대해  충분한 사회적 대화가 필요하다 고 했지만 당은 속도전을 예고한 것이다   일 정치권에 따르면 민주당 노동존중선거대책위원회는  일 국회에서 한국노총과 노동  ,0,0
544, 단독  민주  헌법연구관  정년연장  추진 대법 힘 빼고  헌재 키우기 ,헌법재판소의 숙원인  헌법연구관  정년연장  법안 과 변호사 자격이 없어도 대법관이 될 수 있도록 하는  대법관 자격 완화 법안 이  일 더불어민주당에서 나란히 발의됐다  정치권에선  대법원의 힘은 축소하고  ,0,1
545,광주 시내버스 노사 임단협 불발  일 파업,노조는 올해 임단협에서 임금   인상과  세로  정년 연장  등을 요구하고 있지만 사측과 합의점을 찾지 못한 것으로 알려졌다  오는  일  차 조정 회의에서도 임단협이 타결되지 않으면 다음날 노조는 합법적으로  ,0,0
546,광주 시내버스 노사 임단협  차 조정 결렬,노조는 올해 임단협에서 임금   인상과  정년   세  연장  등을 요구하고 있으나 사측과의 입장 차를 좁히지 못한 것으로 알려졌다  오는  일 예정된  차 조정 회의에서도 타결이 이뤄지지 않을 경우  노조는 다음날인  ,0,0
547,민주  택배노조와  노란봉투법 재추진  협약,노란봉투법은  법정  정년 연장 과 함께 노사 입장이 첨예하게 대립하는 대표적 사안이다  경영계는 노란봉투법 처리가 현실화할 경우 사용자 범위를 확대해 원하청 산업생태계를 붕괴시킬 것이라고 보고 있다  불법  ,0,0
548, 평생 세금 냈는데 왜  지붕수리공도 격분 정년   세  법안통과에 발 ,영국  는 이날  덴마크 의회가  정년 연장  법안을 찬성  표  반대  표로 통과시켰다고 보도했다  현재 정년 연령은  살이지만   년에는  살   년에는  살로 높아질 예정이다   살 정년은  년  월 일 이후  ,0,1
549,광주 시내버스 노사 임단협  차 조정 결렬 일 파업 수순,노조는 올해 임단협에서 임금   인상과  세로  정년 연장  등을 요구하고 있지만 사측과 합의점을 찾지 못한 것으로 알려졌다  오는  일  차 조정 회의에서도 임단협이 타결되지 않으면 다음날 노조는 합법적으로  ,0,0
550,노인 표심 잡기 주력   통합 지원 체계 마련     돌봄 자립 균형 강 ,이 후보는 노후 소득 보장 체계와 관련해서는 국민연금 수급 연령에 맞춘  정년 연장 을 사회적 합의를 통해 단계적으로 추진하겠다고 밝혔다  또 주택연금 제도개선 등을 통해 노후 소득 보장을 위한 지원강화에 나서겠다고  ,0,1
551,덴마크는  정년   세  통과했다는데    정년   세  새정부서 탄력받을 ,뉴데일리 전성무 기자   덴마크에서 정년을  세로 연장하는 법안이 통과되면서 잠시 논의를 멈춘  정년 연장  문제가 재조명받고 있다  청년 일자리 부족이 사회문제로 떠오른 현실을 외면할 순 없지만  세계적인 정년  ,1,1
552, 뉴스픽   주 일 어떻게 할거냐  여야  대선 공약  비교 분석,이 후보는  청년미래적금 과 자녀 수에 비례한 신용카드 소득공제율 공제한도 상향  치매 장애 등으로 재산 관리가 어려운 노인을 대상으로 한 공공신탁제  국민연금 수급 연령에 맞춘  정년 연장  등을 공약으로  ,0,0
553,임단협 앞두고 통상임금  동상이몽 변호사가 알려주는 실무자 대응,기존 임단협에서  정년 연장  근로시간 단축  조합활동 확대 등이 주요 쟁점이었던 것과 달리 올해는 통상임금으로 노사 간 난항이 예상된다  통상임금이 주요 화두로 떠오른 계기는 지난해  월 대법원 전원합의체의  ,0,1
554,광주 시내버스 노사 임단협  차 조정 결렬 일 파업 예고,조정 결과에 따라 대규모 버스 운행 차질이 발생할 수 있다  노조는 올해 임단협에서 임금   인상과  정년   세  연장  등을 요구했으나  사측과 이견을 좁히지 못해 지난  일 협상 결렬을 선언했다 ,0,0
555,덴마크   년  정년   세  연장  의회 통과   은퇴 나이    최고,실제 지난 몇주간 수도 코펜하겐에서는  정년 연장 에 반대하는 노동조합의 시위가 벌어졌다  노조 측은  연금수령 나이를 늘리는 것은  완전히 불공평하다 고 주장했다  이어  덴마크는 건강한 경제를 갖고 있지만  ,1,0
556, 영상  이재명이  너무 극단적  반박했던 그 발언 청년 일자리 감소 , 일 경제분과 대선토론 이후 갑론을박 은퇴 앞둔  대  노후 준비 안 돼 찬성   대 취준생  청년층 취업 환경 개선 먼저  열흘 앞으로 다가온  월  일 대선을 앞두고  정년 연장  문제가  뜨거운 감자 로 떠오르고  ,0,1
557,한종사협  더불어민주당 중앙선대위와 복지정책협약 체결,주요 정책 과제는 사회복지서비스 대응체계 확립  복지서비스 확대를 위한 제도 개선 및 인프라 활성화  복지 관련 법 제도 정비  저출산 초고령사회 대응을 위한 사회복지종사자  정년 연장  단계적 추진  선진국 수준의  ,1,0
558,국민의힘  세 이상 버스 무임승차제 도입  공약,연금제도 개혁과 맞물려  정년 연장 이 사회적 화두인 가운데   일하는 노년  일할 수 있는 환경 을 국정의 중심에 놓겠다고도 강조했다  국민의힘은  정년 후 계속고용 이 확고한 추세로 자리잡을 수 있도록 제도를  ,1,1
559,덴마크   년  정년   세 세  연장  의회 통과 유럽 최고,지난 몇 주 동안 수도 코펜하겐에서는  정년 연장 에 반대하는 노동조합의 시위가 벌어졌다  노조는  연금 수령 연령을 늘리는 것은  완전 불공평하다 고 주장했다  이어  덴마크는 건강한 경제를 갖고 있지만  ,1,0
560,  대선공약  국민연금  사각지대  해소 시급  재정 안정화 숙제,수급 연령에 맞춘  정년 연장  등 선언적인 공약만 제시하고  이를 위한 구체적 계획은 밝히지 않았다는 것이다  김문수 국민의힘 후보의 공약에 대해서는  청년 편향적 이라고 꼬집었다  연금개혁위원회 청년세대 참여  ,0,1
561, 논단 재앙 될지 모를 대선후보   토론, 정년 연장 도 하고 젊은 세대 일자리도 늘어난다고 답할 거면 무슨 토론을 하자는 건지   호텔 예약을 취소해도 돈이 돌면 경제가 산다는 식의 괴짜 경제학   이런 식으로 외교에 대해 하루 자고 일어나면 답변이 바뀌는  ,0,0
562,국민의힘 김문수  신 노년이 건강과 품위 지킬 수 있도록 하겠다 ,과거보다 높아진 기대 수명에 맞추어 노인의 개념을  세에서  세로 상향해야 한다는 법적 논의와  정년 연장  등이 노동 인력 부족 문제의 현실적 대안으로 등장하는 이유이기도 하다  국민의힘도 과거와 달라진 새로운  ,1,1
563,연금강화국민행동  이재명 비전 불분명  김문수 청년 편향적 ,이 후보는 국민연금 사각지대 해소 및 연금개혁 지속 추진  군복무 크레딧 확대  수급 연령에 맞춘  정년 연장  기초연금 부부감액 단계적 조정  주택연금 제도 개선 등의 공약을 냈다  이들은  이재명 후보는 공적연금에  ,1,0
564, 정년연장  대선공약  경사노위 계속고용안   정년 이중구조  불러올  , 정년연장 에 대한 노사의 자율적 합의가 없거나 합의에 이르지 못한 경우 사업주의 재량으로 새로운 근로계약을 체결하고 고용형태를 달리해 계속고용을 의무화하는 내용이다  계속고용의무제의 세부유형을  ,1,0
565,이재명 대표  기본사회  구상안 두고 국민의힘  발칵 김문수   말이라 , 정년 연장 도 사회적 합의로 추진할 것 이라고 밝혔다  이 후보는 또  태어날 때부터 노후까지 생애주기별 소득 보장 체계를 촘촘히 구축할 것 이라며  아동수당 지급 대상을 단계적으로 확대하고 청년 미래 적금을 도입해  ,1,1
566, 시민의 발  서울 대중교통 진퇴양난 버스 노사 서울시 줄다리기,이 밖에도  운전직 호봉 상한 상향 호봉 호봉   정년  만  세  연장 현행 만  세   하계 유급휴가  일 신설  고용안정협약 체결 등이 노조 측 요구안이다  반면 조합 측은 준공영제를 시행 중인  개 광역시의 지난해  ,0,0
567, 대 대선후보에 바란다 최태원  이재명 김문수 만나 경제계 목소리 ,손경식 경총 회장은  일률적  정년 연장 보다 퇴직 후 재고용 등 유연한 방식으로 고령자 일자리 문제를 해결해야 한다 며  일자리 형태가 다양해지고 근로자의 니즈도 변했음에도 근로 시간 제도가  여년 전의 틀에 머물러  ,0,0
